Text,Category
This Guy's Beautiful Portraits Will Leave You Speechless,1
Crown Prince Sultan of Saudi Arabia dies,0
I Tweeted That Ariana And Frankie Grande Were The New Michael And Janet And People Freaked The Fuck Out,1
Explosion at new shopping centre in Bath United Kingdom,0
File-Sharing Site Violated Copyright Court Says,0
19 Secrets Hotel Receptionists Will Never Tell You,1
Selig Looks to World Baseball Classic to Cement His Legacy,0
31 Things To Do While You're Still Young,1
Ronald Moore Lifts Siena While Carrying Own Burden,0
Gunman charged with killing three in Wisconsin shooting,0
The Evolution of Tim Wakefield Knuckleball Pitcher,0
An Artist Drew Disney Men As Justin Bieber And The Outcome Is Glorious,1
21 Photos Of Flight Attendants Living The Life In Overhead Bins,1
Anxiety In Wonderland I Illustrated My Anxiety And This Is What It Looks Like,1
Suspect arrested after hijacking Mexican airliner,0
Russia Opens LNG Plant to Supply Asia With Fuel,0
Arkansas Tops Fullerton and LSU Defeats Virginia,0
The Most Delicious And Foolproof Way To Cook Salmon,1
Man Uses Obituary To Ask People Not To Vote For Donald Trump,1
20 Solo A Cappella Videos That Are Truly Masterpieces,1
Nadal Masters Clay  by Being Consistent and Relentless,0
2009 Shri Shyam Bhajan Hindu religious festival held in Hyderabad,0
Daily and Sunday Sport owners to enter administration,0
Asking For Help In A System That Doesn't Speak Your Language,1
Michael B Jordan Got Laid The Fuck Out While Filming Creed,1
Hidden treasure worth billions of dollars discovered in Indian temple,0
Interview with Innocent Watat City Council candidate for Wards 3 & 4 in Brampton Canada,0
This Grandma Had The Perfect Response To Finding Out Her Granddaughter Was Engaged To A Woman,1
Tour de France Tom Boonen wins stage 6,0
Olmert Rejects Hamas Demands for Soldier,0
21 Times You Instantly Fell In Love With Kendall Jenner,1
This Calculus Teacher Dressed As Drake And Danced To Hotline Bling For His Students,1
Czech Party Leaders Agree to Early Election,0
Apple introduces iPhone and Apple TV,0
Japan Vows More Stimulus Spending,0
Big Brown victorious in Kentucky Derby runner-up Eight Belles breaks down,0
Madrid bombing suspect arrested in Belgrade,0
22 Harry Potter Tumblr Posts That Will Give You So Many Feels,1
French Open Stosur and Schiavone to compete in women's final Nadal to meet Soderling in men's final,0
Wyclef Jean considering standing for president of Haiti,0
Obama Undercuts Whistle-Blowers Senator Says,0
24 Pictures That Will Make You Lose Faith In The Education System,1
Seven dead one missing two survive French helicopter crash off Gabon coast,0
Romania to adopt euro between 2012 and 2014,0
Dispensers of Marijuana Find Relief in Policy Shift,0
In Singapore a More Progressive Islamic Education,0
In Hard-Bitten Baghdad Tough Tactics on Strays,0
38 Ways To Clean With Things You Have In Your Kitchen,1
So Kristin Chenoweth Loves Trisquits,1
Detroit Mayoral Candidate Admits Making False Claims About His Education,0
Sri Lanka Encircles Rebel Fighters,0
Formula One Renault dismisses Piquet Schumacher barred from practising,0
Xerox 4th-Quarter Profit Falls to Nearly Nothing,0
Facebook Backtracks on Use Terms,0
Would You Pass Fourth Grade Anatomy Today,1
Can We Guess Your Zodiac Sign Based On Your Favorite Gift,1
Teenage gunman kills 15 in south-west Germany,0
With Just One Question We Can Tell You If You're The Very Worst Of Humanity,1
Chinese human rights activist faces trial,0
The Story Of A Reporter Who Killed Herself On Air Is Taking Over Sundance,1
Can You Guess The US City From A Single Photo,1
What Basic Fall Activity Should You Do With Your SO,1
New Hampshire Governor Likely to Sign Same-Sex Marriage Bill,0
Which Nativity Scene Member Are You,1
Thousands to celebrate twenty years since fall of Berlin Wall,0
Brother Can You Spare $350 a Game,0
Overhaul of Florida Voting Rules Is Proposed,0
13 Struggles Of Waiting For Halloween To Arrive,1
18 Notable Butts In Bosch's Garden Of Earthly Delights,1
US Soldier Kills 5 of His Comrades in Iraq,0
How Our High School Friendships Shape Us According To Paper Towns,1
19 Shirts That Pretty Much Sum Up Life,1
A 1-2 Finish for Brawn in Australian Prix,0
US Secures New Supply Routes to Afghanistan,0
We Know What Season You Were Born In Based On Random Questions,1
Brie Larson's Response To Being Called An It Girl Will Make Your Day,1
How Well Do You Know The Maze Runner,1
Australian researchers confirm stress makes you sick,0
In Sun Oracle Sees a Software Gem,0
We Know If You Have A Pet Based On Random Questions,1
Snapchat Ran An Ad For Booze During Its Hajj Story,1
Joseph Gordon-Levitt Made A DIY Yoda Costume For The Star Wars Premiere,1
A Group Says French Media Are Pronouncing This Guy's Name Wrong,1
8 Fall Shows To Be Excited About 10 To Give A Chance And 6 To Avoid,1
Brazilian soccer player's mother freed by kidnappers,0
Here Are Twilight's Bella And Edward Gender-Swapped,1
Bernanke Defends His Role in Merrill Sale,0
US televangelist Pat Robertson apologizes for assassination remark,0
How Spooky Are You Actually,1
Which Badass Anime Character Are You,1
Here's What Iconic Movie Posters Looks Like Without Their Words,1
US federal judge dismisses targeted killing lawsuit,0
19 Lies All Parents Are Guilty Of Telling In Public,1
Oversaving a Burden for Our Times,0
British Chancellor George Osborne downgrades growth forecast in annual budget,0
Can You Name The Stuff In Our Solar System,1
Everything You Need To Know About The Man Behind Lord Varys,1
We Know Which Hunk Will Make You Orgasm Based On Your Favorite Disney Movie,1
The Old Rangers Return,0
23 People Who Totally Nailed The Black Lipstick Trend,1
47 Of The Most Important Cher Tweets Of The Last Five Years,1
Inter lead race to snap-up Figo,0
Do We All Unknowingly Have A Gender Bias,1
Abdelbaset Ali al-Megrahi moves to drop Lockerbie bombing appeal,0
Tighter Budgets Affect College Sports Recruiting,0
The Woman Leading A Crusade To Tell More Asian-American Stories,1
This Adorable Little Girl Proves That Not Every Girl Wants To Be A Princess,1
21 Food-Inspired Dog Names That Are Actually Really Cute,1
Job Losses Pose a Threat to Stability Worldwide,0
Which 2016 Movie Are You More Excited About,1
We Reenacted What Kids Said About Black Leaders And It's Amazing,1
Are You More Like Ina Garten Or Giada De Laurentiis,1
Kyrgyzstan to Give US 6 Months to Leave Base,0
What's Your Actual Age Based On Your Favorite Childhood Gaming System,1
How To Shut Down Catcallers,1
Business Opportunity Knocks Even in Bad Times,0
Man charged over London bombings,0
24 Hilarious Tweets That Perfectly Capture Your Existential Despair,1
At least 22 killed in blast in central Pakistan,0
Former Pantera-guitarist Dimebag Darrell killed on stage,0
We Know Your Favorite Dog Breed Based On Your Favorite Snack,1
23 Times Tumblr Blew Your Damn Mind,1
American Team Plans to Expand Formula One Popularity,0
How Well Do You Know The Lyrics To The Christmas Song,1
Watch Asif Confess What It's Like When A Breakup With Your Best Friend Becomes A Massive Meme,1
As Real Madrid Packs in Players Some Must Go,0
Which Orange Is The New Black Inmate Would Be Your Prison Nemesis,1
The Hardest Harry Potter Spelling Test You'll Ever Take,1
Joseph Gordon-Levitt Spectacularly Re-Creates Janet Jackson's Rhythm Nation Dance,1
Ever Calm Furyk Is in Position to Surprise at Masters,0
2008 Tour de Taiwan Stage 4 Intensive circulation at Taichung City,0
Seattle's oldest newspaper to become online-only,0
5 Great Books To Read In February,1
Climate campaigners scale UK Parliament and hang protest banners from the building,0
17 Heartbreaking Confessions From College Students Who Suffer From Depression,1
Can You Match These Eyebrows To Their Celebrity Owners,1
Lifeline and Tracfone Provide Cellphones for the Needy,0
Man arrested over prostitutes' murders in Great Britain,0
25 Of The Best Tumblr Memes Of 2015,1
Wreckage victims of Air France Flight 447 found,0
20 Creepily Fascinating Things From Scotland Yard's Hidden Museum Of Crime,1
Bridge collapse kills at least five in Massana Andorra,0
Maisie Williams Has A YouTube Channel Now And She Brought Sophie Turner,1
24 Pictures That Prove That There Is Nothing Cats Won't Sit On,1
Chloroform spill forces evacuation of building at Canisius College in Buffalo New York,0
21 Tweets About Thanksgiving That Are Way Too Real,1
We Need To Talk About Lex Luthor In Batman V Superman,1
If The Beatles Were Scientifically Accurate,1
At Least 74 Miners Are Killed in China Blast,0
14 Times Space Was Trippier Than LSD,1
Tamil Tigers Confirm Death of Their Leader,0
What Disney Gift Should You Get The Disney Fan In Your Life,1
Over two million people displaced by flooding in India,0
A Canadian Guy Dissed Tim Hortons Coffee So He Could Get A Date In England,1
ACLU Gen Sanchez possibly perjured himself at 2004 Senate inquiry,0
At least one dead eighteen injured after grenade attacks in Rwanda,0
At least thirty dead after bus accident in India,0
60th anniversary of Nuremberg trials marked,0
Ryan Reynolds Had The Perfect Response To The Sexist Marketing Of Superhero Movies,1
21 Times Hipsters Went Too Damn Far,1
Stop What You're Doing And Listen To This Hilarious Golden Girls Remix,1
16 Snapchats That Prove DJ Khaled Is The Hero We All Need,1
Controversial wind farm approved by US government,0
US UK investigators collaborating after US 777 incident similar to London crash,0
21 Delicious Holiday Desserts You Won't Believe Are Sugar-Free,1
Former UK MP Mo Mowlam 'critically ill',0
Civilian Jury Considers Death Penalty for Ex-GI,0
Wikipedia features Encyclopædia Britannica on its main page,0
Justin Bieber's GQ Cover Will Make You Feel Some Type Of Way,1
Which Breaking Bad Character Said These Famous Last Words,1
13 Gilmore Girls Storylines The Fans Demand To See In The Revival,1
Honda recalls fire risk cars,0
If Donald Trump Tweets Were Motivational Posters,1
Watch This Trans Teenager's Emotional Reaction To Getting Her First Dose Of Hormones,1
Rockets kill ten civilians in Afghanistan,0
In Budget Deal California Shuts $41 Billion Gap,0
Runaway train causes chaos on London Underground,0
This Is What Holiday Shopping Looked Like Way Before Black Friday,1
Juventus Putting Pressure on Inter in Serie A,0
Tracy Morgan Receives Standing Ovation At The Emmys After Traumatic Brain Injury,1
Crossing guard killed by truck in Glasgow Scotland,0
British charities form fund recovery group,0
Baucus Takes Lead on Health Care,0
Convicted murderer Leonard Peltier again denied parole,0
Abu Ghraib prison camp struck by tractor bomb,0
Brazilian Landless Workers Movement attacked in Minas Gerais,0
Name That Disney Fish,1
Sure-Footed Boonen Captures His 3rd Paris-Roubaix,0
We Know Which Raccoon GIF Will Make You Happy Based On Your Zodiac Sign,1
Can We Guess Your Favorite Holiday With Questions About Food,1
Here's How Keeping Up With The Kardashians Addressed Lamar Odom's Overdose,1
Former North Korean Agent Makes Public Appearance,0
13 Apps That Might Make Dating Less Horrible,1
Iraqi Airways drops flights to United Kingdom and Sweden,0
Former Serbian president Milutinovic acquitted of war crimes,0
Lenders Challenge Delphi Plan to Exit Bankruptcy,0
Kwik-E-Mart promotion drawing thousands of visitors,0
Tour de France The race begins in earnest,0
Missouri Is Too Much for Cornell,0
After Season in Flux Knicks See Stability in Their Future,0
Q-and-A With Retiring Big East Commissioner Mike Tranghese,0
16 Photos That Capture What It's Like Renting In Toronto,1
New 'failed states index' report published,0
This Adorable Polar Bear Cub Just Discovered Snow,1
Looking Past an Affair to a Race for Governor in South Carolina,0
Sewerage project starts in Pakistan,0
Door opens mid-Qantas flight plane makes an emergency landing,0
Argentine Supreme Court declares Riveros pardon unconstitutional,0
Canadian city announces first Studios of Brampton tour,0
Queen Elizabeth II unveils New Zealand Memorial in London,0
16 Products You Probably Own If You Were Slightly Obsessed With High School Musical,1
17 Dads Who Are Dad AF,1
All Eyes on Gallinari as Knicks Plan to Woo James,0
Are You More Justin Timberlake Or Jimmy Fallon,1
This Clever Artist Makes Hilarious Collages With His Dogs,1
15 Reasons You Need Cheese In Your Life,1
Boxing Pacquiao and Diaz trade verbal punches,0
17 Photos That Won't Make Any Sense To Men,1
Three American hikers arrested in Iran,0
15 Lazy And Delicious Pumpkin Spice Latte-Flavored Desserts You'll Want To Make Right Now,1
17 Paleo Breakfasts That Are Actually Delicious,1
FBI Finds Stanford Missing Financier in Virginia,0
Can We Guess What You Hate Most Based On How You Swear,1
Can You Remember How To Solve The Puzzles From Putt-Putt Saves The Zoo,1
How Well Do You Remember A Christmas Story,1
Cyprus detains weapon-laden ship,0
Detroit chemical plant experiences explosions fire residents evacuated,0
For Everyone Who Knows Neville Longbottom Was The Best Damn Character In Harry Potter,1
Facebook Life Achievements Only Book Lovers Will Understand,1
7 Recipes From Abuelita's Kitchen,1
21 Tiny Fashionable Hats You Can Make For Your Cat,1
Disney Villains Reimagined Without Makeup,1
In a Fight Over Names Russia Vetoes a UN Mission Inside Disputed Territory,0
19 Honest Confessions That Are Too Real For People Who Are Painfully Shy,1
8 Animals That Are Totally A Little Gay,1
Former South African official Jacob Zuma charged with rape,0
Crackdowns on Protesters Drape Tehran in Silence,0
Ovechkin and Capitals Surge Past Penguins,0
In Recession Strategy Shifts for Big Chains,0
Shift on Marijuana Policy Delays Sentencing,0
33 Badass Pictures From The Golden Age Of Tattoos,1
Tropical storm hits Philippines 45000 people displaced,0
If You Talked To People Like Your Pets,1
Texas governor Rick Perry to announce his presidential intentions,0
Russia launches Progress spacecraft to resupply Space Station,0
26 Times Trans People Ruled In 2015,1
Consumer database of several major North American stores hacked,0
Poland made software patent directive stop,0
23 Of The Best Burns From That '70s Show,1
10 Ridiculously Easy And Delicious Soups That Are Perfect For Fall,1
17 Times Social Media Saved The Day In 2015,1
21 Things You'll Just Get If You Only Wear Black,1
14 DIY Canopies You Need To Make For Your Bedroom,1
12 Photos Of People Who Have Won Millions Playing Powerball,1
Photo source for Barack Obama presidential campaign HOPE poster discovered,0
Australian Labor Party leader urges supporters to take a cold shower over poll results,0
Benedict Cumberbatch Had The Best Response Ever To A Mean Tweet About His Appearance,1
On Business Eyes Peeled for Fliers of Another Sort,0
25 Things You Didn't Know Your iPhone Could Do With iOS 9,1
Brazil Political crisis Minister José Dirceu leaves the government,0
23 Online Stores You Still Have Time To Order From,1
How Bethpage Black Was Mastered For a Day By a Club Pro,0
Police arrest two over Exeter bomb explosion,0
How Much Like Kanye West Are You,1
21 Times Things Got Too Real Too Fast,1
International experts probe deadly Ebola Reston virus outbreak in Philippine pigs,0
Jason Derulo Just Performed On A Hoverboard At The EMAs And It Was Glorious,1
Tom Cruise spoofed in film 'Superhero Movie',0
Rob Broudie top British lawyer found dead,0
Iran Executes 13 It Calls Sunni Rebels,0
This Is What The Harry Potter Characters Looked Like In The First Movie Vs The Last,1
German president dissolves parliament elections in September,0
Subway train derails in Washington DC,0
Here's 12 Awkward Christmas Gift Stories,1
Can You Guess The Animorphs Title Based On Its Cover,1
Are You More Halloween Jack Or Christmas Jack,1
US FAA to make airliner fuel tank inertion mandatory over 1996 air disaster,0
Canadian power worker says grid is 'String of Christmas Lights thats been Running Since the 1950s',0
Massachusetts governor Mitt Romney not seeking second term,0
18 Things That Always Happen To People Who Hate New Year's Eve,1
8 Hilarious Comics That Only Book Lovers Will Understand,1
Michigan Is Latest to End Apparel Deal With Russell,0
Gaza Strip aid ship departs Greece diverts to Egypt,0
NuCaptcha introduces a video captcha service ads included,0
Lockerbie bomber Abdelbaset Ali al-Megrahi released on compassionate grounds,0
Someone Keeps Accidentally Texting A Guy With An Awesome Beard And His Replies Are Hilarious,1
St Patrick's Day around the world,0
Immigration raid at Ohio poultry plant,0
26 Adorable Dogs Who Are Slaying The Fall Fashion Game,1
New bridge lowered into position as East London line extension work progresses,0
Apaches accuse Prescott Bush of robbing Geronimo's grave,0
69 Excellent Indie Records You May Have Missed In 2015,1
These NSFW Chain Texts Teens Are Sending Each Other Will Make Your Jaw Drop,1
34 Disturbing Photos From SantaCon That Will Ruin Your Christmas,1
18 Moments Of Incredible Humanity During The Chennai Rains,1
Your Choice Of Christmas Cupcake Will Reveal Your Darkest Secret,1
16 Confessions Only True Harry Potter Fans Will Understand,1
21 Confessions From People Who Can't Put Their E-Books Down,1
This Is What A London Pigeon Actually Does All Day,1
NASA denies rumors of finding life on Mars,0
Russia joins South Ossetian war,0
17 Songs That Are Older Than The Class Of 2019,1
25 Of The Best Guests Taylor Swift Brought On Stage In 2015,1
Can You Make It Through This Post Without Drooling,1
10 Delicious Recipes That Are Made With Coconut Milk,1
A Basic-Ass Guide To Men's Shirt Collars,1
22 Really Weird Things Dogs Actually Do,1
15 Christians Who Don't Care At All About A Starbucks Cup,1
Which Naughty Disney Fantasy Do You Belong In,1
Seven-year-old raises £100000 for Haiti in sponsored bike ride,0
Redding Falters Again,0
US and Mexico to revise counter-drug strategy,0
27 Adorable Giraffe Products You Need In Your Life,1
Here's A Look At 100 Years Of Halloween Costumes,1
Being In A Relationship During The Holidays Expectations Vs Reality,1
English policeman accused of being serial rapist,0
Which Nirvana Song Are You Based On Your Zodiac Sign,1
Justice Iftikhar Muhammad Chaudhry reinstated as Chief Justice of Pakistan,0
Rambus Settles European Inquiry Over Chip Patents,0
Here Is ABC Family's Hocus Pocus Schedule For Halloween,1
APEC 2005 wraps up,0
Posh Spice And Nicki Minaj Praised Adele For Her Epic Covers,1
Women React To Awful Sex Advice Throughout History,1
9/11 health care bill passed in US House of Representatives,0
This Test Will Determine Who You'll Marry,1
19 Of The Stupidest Ways People Have Broken Their Laptops,1
Inauguration Dress Rehearsal Looks Almost Like the Real Thing,0
Which Famous Teenager Are You,1
Lawmakers Seek to Return Right to Sue Device Makers ,0
Which Iconic America's Next Top Model Contestant Are You Based On Your Zodiac Sign,1
Apple executive Steve Jobs resigns,0
May Ends With a Winning Streak Intact,0
What's Your Secret Personality,1
Merck-Schering Merger Awaits Reaction From Johnson & Johnson,0
Sailor Senshi Imagined As Disney Princesses,1
Iraq Suffers as the Euphrates River Dwindles,0
Resignation of JetBlue flight attendant Steven Slater announced,0
Bankruptcy Protection Filing at Minneapolis Star Tribune,0
McCain volunteer fakes mutilation by Obama supporter,0
19 Foods That Should Never Have Been Invented,1
Pittsburgh Dominates San Diego to Reach AFC Title Game,0
Canadian province receives warning from Exxon,0
On Field Ice or Court Brothers Were Not Equals,0
Iran announces its building of a second nuclear power plant,0
Gerard Butler Looked Like Grumpy Cat At The Golden Globes Afterparty,1
13 drug-resistant TB cases reported in Thailand,0
Pakistani Charged in Mumbai Assault,0
This Color Test Will Determine Your Ideal Sex Position,1
Toyota Moves Ahead of GM in 2008 Sales,0
Stampede at German music festival kills nineteen,0
Spain's unemployment rate surpasses 17 percent,0
Please Everyone Stop Saying Squad Goals,1
Laboratory fire forces evacuation of Australian National University,0
Kanye West Allegedly Paid His Models $100 For A 10-Hour Workday,1
Senators Too Tough for Rangers,0
Three Mutual Funds That Found Glimmers of Hope,0
24 Situations That Will Make You Cringe Until You Cry,1
Anna Faris Thinks Chris Pratt's Balls Are Sexy And Perfect,1
Austrian man kept daughter prisoner in cellar for 24 years,0
What Are You Getting Rid Of In 2016,1
21 Things You'll Understand If You've Ever Been To The Cheesecake Factory,1
Nokia scales back prediction for global mobile phone sales,0
We Know What TV Show You've Binge-Watched Based On Your Relationship Status,1
23 Reasons Why You Should Follow Polls On Twitter,1
Queensland Premier aims for a move to Australian federal politics,0
13 Black Women Share Their Postpartum Depression Experience,1
There's Now Weed For Menstrual Cramps That You Stick In Your Vagina,1
McCoughtry and Moore Set Stage for Title Game,0
How Has Your Favourite NHL Team's Logo Changed Over Time,1
Report Annan failed to fix Oil for Food program,0
Multifaith council commends Malaysian politician's comments on conversion to Islam,0
Wikileaksorg restored as injunction is lifted,0
19 Fixes For Every Clothing Emergency,1
The 2015 Emmys Were Literally The Hottest Emmys Ever,1
16 Cute And Practical Valentine's Gifts,1
Tamil protests underway in Oslo,0
US air force colonel claims he spotted UFOs over Arkansas,0
US Is Pressed to Add Billions to Bailouts,0
What Do You Miss The Most About College,1
Which Classic Cocktail Are You,1
A Man Returned His Wife's Woman Of The Year Award After Caitlyn Jenner Received One,1
A Revolving Door of Editors and Publishers,0
2007 Twenty20 World Championship India vs Scotland,0
10 Amazing Candid Wedding Moments You Won't Believe Were Captured On Camera,1
Which Of The Four Major Temperaments Are You,1
13 Peruvian Troops Killed in Ambushes,0
19 Things You'll Understand If You're Slightly Obsessed With Masturbating,1
If Hogwarts Were A College,1
Former Pennsylvania State Senator Vincent Fumo convicted of fraud corruption,0
Vyacheslav Tikhonov Russian actor most famous for Stirlitz dies at 81,0
Aussies ignore flag ban at Big Day Out festival,0
Medtronic Drops Dr Kuklo Accused of Faking a Study,0
Pittsburgh Pirates rally to defeat New York Mets 6-5,0
26 Incredible Things For People Who Love Yellow,1
UK Prime Minister sets 2005 General Election date,0
25 Adorable Presidential Pet Photos That Will Melt Your Heart,1
King of Bahrain declares state of emergency,0
Damn What Percent Daniel Are You,1
The Most Badass Graphic Novel Ever Created Has Been Published,1
Bush speaks of goals for US withdrawal from Iraq decries calls for timetable,0
The 14 Worst Things People Have Put In Their Mouths,1
Swimmer Mary DeScenza Mounts Comeback After Missing Cut for Beijing,0
25 Times Billy Eichner Was The Most Hilarious Person On Twitter,1
FDA says Coca-Cola's Diet Coke Plus is misbranded,0
This Fake Black Friday Movie Trailer Needs To Be A Real Thing,1
103 Game Of Thrones Quotes That Make Perfect Instagram Captions,1
Being A Single Woman In New York In The Movies Vs In Real Life,1
Haiti postpones presidential elections until December,0
Obama Is Nudging Views on Race a Survey Finds,0
Did You Ruin Everything,1
How The Martian Went From A Best-Selling Novel To A Blockbuster Film,1
24 Miss J Alexander Reaction GIFs For Any Situation,1
37 Songs You Need In Your Life This February,1
This Green Dot Test Knows How Easily You Get Jealous,1
31 Behind-The-Scenes Photos Of Grease Live You Might Have Missed,1
A Traditional Lacrosse Power Syracuse Adds a New Twist,0
We Had People Try The Smelliest Fruit In The World,1
Man arrested after crashing motorized bar stool while drunk,0
2 Chainz Pays Veteran's Rent For An Entire Year,1
24 People Who Are Setting World Records For Laziness,1
Another Round Episode 40 Blacker History Month,1
Retiring From GM Lutz Holds Little Back,0
31 Meal Prep Photos That Are Ridiculously Satisfying,1
Obama Toughens Lighting Rules to Cut Energy Use,0
15 Reasons Canadians Should Actually Be Happy It's Fall,1
India Undertakes Ambitious ID Card Plan,0
Billionaire philanthropist Leonore Annenberg dies at 91,0
2007 FIFA U-17 World Cup Ghana beat Peru in Quarter finals,0
JP Morgan apologizes for slavery,0
UK's oldest museum reopened,0
Rudd replaces Beazley as Australian opposition leader,0
13 Divine Ways To Cook With Pomegranates This Holiday Season,1
Muslim youth to guard Christian churches in Indonesia,0
Louisville Men Build Reputation on Pressure Defense,0
Here's Why Paw Patrol Is A Terrible Kids' Show,1
Pittsburgh Caps Rally to Win Stanley Cup,0
Premier League 200809 Blackburn Rovers FC hire Ince,0
Thai Queen attends protester cremation as report indicates explosive tear gas used,0
Irish government orders recall of all pork products,0
His Future Behind Him Lewis Heads for Prison,0
Ghana's first female Chief Justice receives award,0
Cuomo Tries to Enforce Notification to Debtors,0
Olivia Wilde And Jason Sudeikis' V-Day Plans Will Make You Envious,1
Only Solve This Puzzle If You Love Board Games,1
That One Small Step Is Still Hard to Measure,0
Recession Drains Social Security and Medicare,0
For Anyone Whose Face Is Permanently Frozen With One Expression,1
Canadian light aircraft stolen Wisconsin State Capitol evacuated,0
11 Everyday Problems Solved With The Power Of Perspective,1
If Rom Coms Were Realistic,1
I Went To A Black College Because Of A Different World,1
Quiznos restaurant chain airs controversial commercial,0
One shop defies court order one shop returns to work in Dublin Thomas Cook occupation,0
11 Movies All Rom-Com Fans Should Actually Watch,1
JK Rowling Has Some Important Opinions About Whether Snape Is A Hero,1
Can You Guess The 25 Most Common Passwords,1
Are You More Nickelodeon's Doug Or Disney's Doug,1
Raúl Castro chosen as new President of Cuba,0
Daniel Radcliffe Keeps Forgetting That He Played Harry Potter,1
Taylor Swift Is At A Loss Of What To Do During A Fire Alarm,1
These Adorable Old Greyhounds Use An Elevator To Get Around,1
