Text,Category
7 Excellent Post-Christmas Sales To Shop This Week,1
Former Texas nurse charged with murder for allegedly injecting bleach into patients,0
How Well Do You Know American Pie,1
These Eerie Photos Capture The Oddball Beauty Of Suburban America,1
We Know If You're A Cat Or Dog Person Based On Your Favorite Animals,1
Can You Navigate A Day With Depression,1
Which 2015 Slang Term Are You Based On Your Zodiac Sign,1
Here's What YouTubers Have To Say About Mental Health,1
What Book Helped You During Your Depression,1
Australian PM will not serve full term if re-elected,0
India wins its first cricket Test in South Africa,0
Plane crashes into Toronto office building,0
18 Booty Call Confessions That Are All Too Real,1
US flag burning amendment approved by House,0
Rachel Green From Friends Appeared On SNL And It Was Everything,1
21 Cats Who Will Sway The Non-Believers,1
32 Containers That Will Make You Want To Organize Immediately,1
Fuck Marry Kill The Dude Names Edition,1
Tina Fey Gave The Perfect Answer To A Question About Women In Comedy,1
What Scandal Would Olivia Pope Have To Fix For You,1
BBC to release iPlayer to other broadcasters,0
Who Is This Person's Famous Mom Or Dad,1
Blob off Alaskan coast identified,0
Danish and Norwegian embassies set on fire,0
A Bride Says She's Outraged After She Missed Part Of Her Honeymoon Over A Damaged Passport,1
22 Of The Most Disgusting Things People Have Actually Put In Their Mouths,1
Obama delays arrival to Copenhagen summit by one week,0
19 Small Awards Anyone With Anxiety Deserves To Receive,1
Nine missing after US Coast Guard plane and Navy helicopter collide,0
Which Song From Revival Are You Actually,1
22 Halloween Treats That Are Much More Festive Than Candy,1
What Type Of Penis Would You Be,1
Nepali capital Kathmandu shut down after rebel strike,0
Tsunami bulletin issued from Pacific coast of California-Mexico border to Vancouver Canada,0
25 Fans Who Are More Genius Than The Players,1
Florida prisons ban inmate smoking,0
24 Low-Carb Spaghetti Squash Recipes That Are Actually Delicious,1
What Are The Best Baby Products On Amazon,1
17 Awards All Makeup Lovers Deserve,1
Review Panel Hears Rival Plans for New Spaceflights,0
17 Snacks That Do A Convincing Impression Of Fries,1
UK revokes visa of former Thai PM,0
International response to demolition of Hare Krishna property in Kazakhstan,0
We Have To Talk About Selena Gomez Right Now,1
A Hall of Fame Find by a Sports Reporter,0
Tell Us About Yourself Tia Mowry,1
California company recalls fresh spinach over salmonella contamination,0
Diamonds Anglo American to pay US$51 billion for 40% of De Beers,0
These BFFs Imitated Each Other And It Was Hilarious,1
Copenhagen climate conference ends with meaningful agreement,0
Brazil Expands Investment in Offshore Drilling Projects,0
has anyone told Karen Slaughter  Have a lovely time ,1
thank you I'm glad I made you laugh ,1
they will laugh actually ,1
feeling much better now Look am laughing ,1
Can You Identify These Super-Zoomed-In Celebrities,1
29 Songs That Will Remind You Of Your High School Sweetheart,1
Egypt to open Gaza Strip crossing for humanitarian and medical aid,0
Fats Domino rescued in New Orleans,0
Kanchi Shankaracharya Jayendra Saraswathi in custody,0
Advocates of Gun Rights Are Poised for a Victory,0
41 killed by suicide bombing near Pakistan's Swat valley,0
BBC and Sky networks reject Gaza appeal,0
Tense panel discussion on Srebrenica held in Belgrade,0
We Need To Talk About Starbucks's Siren Logo,1
Next Week's Episode Of Keeping Up With The Kardashians Addresses Lamar Odom's Overdose,1
Minnesota boy with cancer and mother return to abide by court rulings,0
Mother child found dead in Minneapolis collapse site,0
27 Moms Who Are Trolls At Heart,1
These Are The Photos By Indians Shortlisted In The World's Biggest Photography Contest,1
19 Reasons Costco Is All You Could Ever Want And Need,1
The Nintendo 64 Would Be A Sophomore In College Now If It Were Human,1
Two Chicago schools evacuated as suspicious package found,0
Effort to Regulate Salt Angers German Bakers,0
Kung Fu star Carradine found dead in Bangkok hotel,0
Increased tension in border dispute between Eritrea and Ethiopia,0
26 Products Every Whale Lover Needs In Their Home,1
Swimmer Michael Phelps of the US wins first gold medal of 2008 Summer Olympics breaks world record,0
Madoff Never Made Supposed Investments,0
Toyota quits Formula One,0
13 Backyard Rinks That Will Give You The Chills,1
15 Game-Changing Eyeliner Charts If You Suck At Makeup,1
Anti-tax tea parties held across the USA,0
What's The Biggest Misconception About Being A Military Spouse,1
Police warn of possible bomb threat in central London,0
Apples top most contaminated produce list,0
Zimbabwe cabinet meets without MDC ministers after boycott,0
Mozilla sets record for most software downloads in 24 hours,0
McNamee Says He Injected Clemens at Yankee Stadium,0
US House approves $117 billion in Amtrak funding,0
See 100 Years Of Japanese Beauty In Just Over One Minute,1
Salmonella in Pistachios Spurs Recall,0
Negotiations for hijacked Saudi oil tanker begin,0
CNN typo mixes up prospective US presidential candidate with Osama bin Laden,0
22 Photos Of What Halloween Looked Like In The '90s,1
Emirates jet tail strikes runway during takeoff at Melbourne airport,0
Car crashes into house in Suffolk UK seriously injuring man,0
Lady Gaga's New Disco Cover Will Make Your Weekend,1
A Dutch Organization Is Providing Free Abortions For Women In Zika-Affected Regions,1
Venezuelan president Hugo Chávez cuts relations with Colombia,0
21 Things That Were Cool In 2006 But Definitely Aren't In 2016,1
Hawthorn wins 2008 AFL Grand Final,0
Two men arrested in Tennessee for plot to kill Obama and school children,0
Cisco Buys Pure Digital Maker of Flip Cameras,0
Three men arrested under suspicion of organising dog fights in southern Finland,0
24 Hilarious Tweets About Moms That Will Make You Laugh Out Loud,1
Suicide bombers kills 31 in Pakistan,0
13 People They Should Cast In The New All-Female Ocean's Eleven,1
What's The Weirdest Thing You've Gotten While Trick-Or-Treating,1
Speaker breaks tie by voting for Canadian budget,0
Beyond Sports a Lesson From Desmond Tutu,0
US energy department reveals world's fastest computer,0
What Should Your Career Actually Be,1
Here's What People All Around The World Find Baffling About Britain,1
Coroner Adds to Questions in Italy Murder Case,0
How Well Do You Know The Geography Of Game Of Thrones,1
Driver dies after truck falls onto railway line in County Durham England,0
IBM Raises Its Quarterly Dividend 10%,0
Can We Guess Your Favorite Girl Scout Cookie Based On Your Zodiac,1
How Do Men Decide When To Have Sex,1
Altering Planes and the Way They Fly to Save Fuel,0
Did The New Star Wars TV Spot Give Away A Secret About Han Solo,1
18 Steampunk Tattoos That Will Transport You To An Alternate Universe,1
Someone Made An Amazing Mashup Video Of Mariah Carey Shading Ariana Grande,1
9 Facebook Events You'd Actually Want To Attend,1
What Type Of Donut Are You Based On Your Birth Month,1
Here's What Happens When You Photoshop Men Out Of The Workplace,1
Man arrested in slaying of six-member family near Tel Aviv Israel,0
Are These Celebrities Naturally Blonde Or Brunette,1
Let This Puppy Proposal Help You Forget The World Is Going to Shit,1
60 reported dead in Congo train crash,0
Thailand forces registration of prepaid phones to thwart insurgency,0
The Rise Fall And Improbable Comeback Of Morris Brown College,1
21 Back-To-School Style Inspirations From Extremely Stylish Canadians,1
Three dead over 70 injured in Bangkok blasts,0
Former Iranian president Hashemi Rafsanjani leads Friday prayers,0
Do You Remember What Year These '90s Movies Were Released,1
Mother of Californian firefighter calls on arsonist to surrender,0
14 Struggles Everyone Who Hates Being Touched Will Understand,1
14 Important Sigils For Twentysomethings,1
19 Insanely Gorgeous Lipstick Colors Worth Every Penny,1
Montana judge frees Barry Beach pending homicide retrial,0
12 Times Tumblr Got Weird AF About Zodiac Signs,1
New Zealand ex-politician gives valedictory speech,0
The Sales Profession Attention Must Still Be Paid,0
Bruins Goalie Tim Thomas Shows He Belongs in the NHL,0
US Senator Ted Stevens convicted on 7 counts,0
A Full Breakdown Of The Long Feud Involving Amber Rose Kanye West And The Kardashians,1
Which Justin Bieber Song Is Your Life Anthem Based On Your Zodiac Sign,1
The 50 Best Jaden Smith Tweets Of 2015,1
Olympic torch faces protests in San Francisco,0
28 Times Breaking Bad Was Really Fucking Funny,1
1 Trip To Trader Joe's $20  5 Easy Vegan Dinners,1
Boeing 737 crash-lands in Colombia at least one killed,0
22 Super Annoying Things Every Woman Has To Deal With,1
These Hot Guys Holding A Puppy Will Make You Feel Things,1
The Hardest 2000s Music Quiz You'll Ever Take,1
Florida suffers from summerlike conditions ahead of cold front,0
Drinking habits tied to genes,0
Boyfriends Try Their Girlfriends' Sexy Halloween Costumes,1
Two deaths unreported in Natrecor study,0
False cancer cure claims lead to federal charges against five US companies,0
The Broad City Season 3 Trailer Is Here And It's Funny AF,1
In China GM Remains a Powerful Player,0
Iran building collapse kills 19,0
World's Largest Ball of Twine Turns 50,0
Greek Prime Minister sworn in new cabinet appointed,0
18 Perfect Responses For When Someone Texts You K,1
19 Hilarious Tweets About The Hunger Games,1
17 Cats Really Loving The Cat Nip,1
In St Louis Glorious Stadium Honors Glorious Past,0
Ailing Mickelson Outplays Watney in Final Round at Doral,0
Twenty killed in Lake George USA boating accident,0
Australian Senate to decide sport footage ownership,0
21 Signs Your Date Isn't Going Well,1
Interrogation Memos Detail Harsh Tactics by the CIA,0
These Hilarious Comics Will Change How You See Disney Princesses,1
Russian Wikipedia a top internet community,0
Volatile stock market credit woes persist,0
Tell Us About Your Self Kym Whitley,1
Are You More Ronda Rousey Or Holly Holm,1
Human rights group alleges US prison ships,0
Australian election debate debacle,0
20 People Who Immediately Recognized Their Mistake,1
Bermuda Premier Escapes Censure Over Uighurs,0
NASA Satellite Fails to Reach Orbit,0
Tour de France Michael Rasmussen wins stage 8,0
US Scrambles for Information on Iran,0
Executives at Barclays Defend Staff Bonuses,0
10 Mouthwatering Dishes That Are As Healthy As They Are Simple,1
Flight recorders from Air France Flight 447 found,0
What Kind Of Pasta Should You Eat With Aziz Ansari,1
California Begins Hunt for Deeper Cuts,0
Federal response to Katrina a national disgrace,0
14 Honest Instagrams About Fall,1
Australia's richest man dies aged 68,0
Tell Us Your Most Embarrassing Teenage Moment,1
Ceremony to Name Court for Carril Is Also a Sad Reminder,0
Donald Trump As Dumplings Is Everything You Need In Life,1
Dozens dead after school collapses in Haiti,0
US Secretary of State Hillary Clinton criticizes Turkey over human rights concerns,0
Pacey Vs Dawson Who Had The Hotter Dec 9,1
Car bomb attack in Iraqi town at least two dead and 45 injured,0
The Hardest Alcohol Quiz You Will Ever Take,1
After Week of Rain Co-Leaders Face the Heat on Monday,0
21 Life Lessons Big Ang Taught Us All,1
Pentagon unable to explain 'mystery missile' video,0
Literally Just 25 Things That Happened At Walmart In 2015,1
Concert for Holocaust Survivors Is Condemned,0
Here's Why You Get All Red When You Have Sex,1
At least seven mountaineers die while climbing K2,0
Son of poet Sylvia Plath commits suicide,0
Does Scott Give You Eastwood,1
What Marvel Movie Are You Most Looking Forward To,1
The 21 Best Mindy Kaling Tweets Of 2015,1
We Can Tell You Who You Should Date With Just Four Questions About Biryani,1
What Makes Butch Hot,1
17 Delicious Pies For People Who Love Baking,1
God Firearms and America Come Together at a Church in Kentucky,0
Women Answer Sex Or Exclusivity First,1
Bulusan Volcano releases some ash,0
France Rejects Plan to Curb Internet Piracy,0
7th Heaven television series comes to an end,0
Mugabe and Zimbabwe Premier Wage Battle of Wits,0
FDA recalls foreign meat used in aid for victims of Hurricane Katrina,0
This Trailer For Joel McHale's Emoji Movie Is Both Hilarious And Terrifying,1
United Nations condemns Palestinian rocket attacks and Israel's 'disproportionate' response,0
Republican leads race to fill Ted Kennedy's vacated US Senate seat,0
Foot and mouth scare in New Zealand likely to be hoax,0
New book Blown for Good reveals details inside Scientology headquarters,0
YouTube Said to Be Close to Video Deal With William Morris,0
Here's How You Can Use Your Slow Cooker And Make Lasagna,1
Million-dollar trial aborted on account of sudoku,0
Motive in Double Killing 42 Years Ago Is Revealed,0
Gunmen kill seventeen at drug rehab centre in Ciudad Juarez Mexico,0
Whales Were Caught On Camera Under The Northern Lights And It's Epic,1
Costs Soar as Iraq Falls Behind on Training Plan Audit Says,0
South African parliament questioned over media policy,0
Do You Conform To The Majority,1
15 Words That Mean Something Totally Different To White People Than They Do To Black Women,1
This Organisation Is Trying To Launch India's First Transgender Model Agency,1
US job cuts last month highest since 1974 unemployment rate rises,0
Ancient prayer book found in Irish bog,0
Scientists Snow on Mt Kilimanjaro to melt in twenty years,0
If Disney Movies Were Blaxploitation Films,1
Troops Arrest an Awakening Council Leader in Iraq Setting Off Fighting,0
Rio de Janeiro to host 2016 Olympics,0
UEFA president Platini confirms Euro 2012 to be hosted in Poland and Ukraine,0
Sri Lanka Rejects Tamil Call for Cease-Fire,0
Death of Kentucky census worker considered suicide,0
Tour de France Alberto Contador wins stage 14,0
As Israeli Bombing Stops Gazans Get Busy Rebuilding Damaged Tunnels,0
Obama Has No Plans to Reopen Nafta Talks,0
No Complaints After Chelsea Gets Nothing in Spain,0
If Kanye's Twitter Rant About Wiz Khalifa Was A Bunch Of Motivational Posters,1
23 Gendered Products That Prove How Truly Fragile Masculinity Is,1
What Advice Do You Wish Someone Had Told You Before You Got Married,1
Hurricane Guillermo forms in Pacific Ocean,0
21 Things Only Former Baby Lesbians Understand,1
From Where She Sits the Favorites Look Good,0
Anne Hathaway Shared An Empowering Photo When Paparazzi Tried To Take Pictures Of Her Baby Bump,1
PSA Leg Shaving Season Is Officially Over,1
31 Actually Helpful Tips For Dealing With Panic Attacks,1
President of Costa Rica contracts H1N1 swine flu,0
Which Shia LaBeouf GIF Matches Your Zodiac Sign,1
Uzo Aduba On Why We Need More Characters Like Crazy Eyes,1
What Phase Of The Moon Are You,1
Never Forget Hilary Duff Once Sucked A Dude's Thumb In A Music Video,1
Police Station Bombed in Tibetan Area of China,0
Euro-Zone Inflation Rate Falls to Zero,0
38 Gorgeous Quotes From Literature That Might Help You Cope With Your Depression,1
Judah Friedlander From 30 Rock Defines Popular Dating Terms,1
What's Your Horoscope For The Week Of November 9,1
Madoff Pleads Guilty to All 11 Charges,0
Service cutoff extended for unresponsive US VoIP users,0
Rebels Routed in Sri Lanka After 25 Years of War,0
26 Priceyish Things You Should Definitely Buy In Your Twenties,1
Nelson Mandela taken off US terrorist list,0
How 2015 Were You,1
16 Words That Mean Something Completely Different At Target,1
Agriculture's impact on human evolution clarified,0
These People Go On A Bar Crawl To Find The Best Nachos In LA,1
The Worst Way To Get Caught Cheating,1
Remember When David Bowie Was On SpongeBob Squarepants,1
If Horror Novels Had More Accurate Titles,1
13 Things I Learned When I Decided To Start Eating Vegetables,1
Can You Identify Celebrities When They Don't Have Faces,1
A String Quartet Performed During A Traffic Jam And Calmed Everyone's Rage,1
This Stunning Video Perfectly Captures All The Highs And Lows Of Breaking The Dahi Handi,1
Anti-censorship developers targeting China's Great Firewall,0
Signs You Overthink Everything,1
Russian government confirms gay protesters to be arrested at Olympics,0
Amber Rose Had A Lot To Say About Kanye After Their Twitter War,1
$175 Trillion Deficit Seen as Obama Unveils Budget Plan,0
FreeTheNipple Investigated By Naked Mike,1
What Animal Matches Your Birth Month,1
EU bans all Indonesian airlines as well as several from Russia Ukraine and Angola,0
Two found dead at Norway Rock Festival,0
Sheffield pub is CAMRA's Pub of the Year,0
What Would Your Specialty Be As A Doctor On Grey's Anatomy,1
What's The Best Way To Flirt On Social Media,1
13 Swoonworthy TV Wedding Vows That You Will Want To Steal For Your Big Day,1
11 Grocery Shopping Tips Every Twentysomething Needs To Know,1
12 PS1 Games That Look 100% Better Now,1
20 Things Filipino Kids Did Before The Internet Existed,1
This Photographer Has Captured Candid Moments In The Lives Of Famous Artists Throughout History,1
Back in America Westchester Cup Revives a Polo Rivalry,0
5 Famous Guys Who Are Masters At Saying One Particular Word,1
61 Thoughts Everyone Has When Going For A Poo At The Office,1
From Blog to Print Laughing All the Way to the Bank,0
New record time spent in space,0
Former US First Lady Lady Bird Johnson dies at 94,0
Pink elephant spotted in Botswana,0
Sri Lanka Presses Rebels but at a Mounting Cost,0
Here's How To Save Money During The 2016 Clean Eating Challenge,1
PETA India CEO Faces Sexual Harassment And Threats For Condemning Bull-Taming As Sport,1
14 Gifts All John Green Fans Will Absolutely Adore,1
Can You Match The Selena Gomez Music Video To Its YouTube Comment,1
Here's Some Glorious Photos Of Voldemort Dancing Enthusiastically At A Photocall,1
Speedskating Provided Marsicano a Refuge From Bullying and Depression,0
Are You More Millennial Or Gen X,1
Plans set in motion for the removal of Bob Barr as the Libertarian Party's US presidential nominee,0
Murdoch empire in crisis after newspaper closes BSkyB bid halted former editor arrested anger at chief executive,0
Iraq Accuses 12 Policemen in a String of Killings,0
Your Perfect End-Of-Summer Mix Is Here From DJ A-Trak,1
17 Cards Your Valentine Will Love As Much As Kanye Loves Kanye,1
Can We All Work Out How The Hell London Spy Is Going To End,1
Strike threat at UK's Northern Rail,0
Stress Tests Prove a Sobering Idea,0
23 Things Women Say Vs What They Actually Mean,1
7 Honest Pieces Of Advice For Scientists From A 90-Year-Old Nobel Laureate,1
Estimated 300-ton radioactive leak at Fukushima rated 'serious incident' by watchdog,0
EU budget chief claims win in Lithuanian presidential elections,0
Israeli President Shimon Peres collapses in Tel Aviv,0
IMF Puts Bank Losses From Global Financial Crisis at $41 Trillion,0
Sofia Vergara Shared Her Thoughts On Objectification Diversity And Boobs,1
WHO states H1N1 swine flu world's most dominant virus,0
If Friends Was Set In The USSR,1
This Goldendoodle Won Halloween,1
Do You Actually Know Which Celebs Wrote These Poems,1
What's The Best Meme About Being A Server,1
What Are Your Best Tips For Keeping The Weight Off,1
US Sees a Smaller GM in the Future Than GM Does,0
Croatian singer beaten in Belgrade,0
Which League Of Legends Yordle Are You,1
Services Make It Easier to Buy via Cellphone,0
A Single College Student Got Tired Of Couples Pictures So She Did A Romantic Photo Shoot With Pizza,1
Insurance Giant AIG Takes Ex-Chief to Court,0
The 17 Most Important British Memes Of 2015,1
Google Threatened With Sanctions Over Photo Mapping Service in Germany,0
US nationals arrested for alleged abduction of Haitian children,0
13 Makeup Tips Every Person With Hooded Eyes Needs To Know,1
Which Severus Snape Quote Matches Your Zodiac Sign,1
Which Carb Is Your Soulmate,1
Afghanistan prepares for presidential runoff election,0
Get Ready To Indulge With BuzzFeed Tasty's Newsletter,1
Three killed in Tennessee vehicle crash,0
Will You Get A Free Car From Oprah Or A Free Tub Of Vaseline From Tyra,1
When Your BFF Is Basically Your Sister,1
Four dead after Yemen police fire on protesters,0
For Everyone Who Secretly Hates Friends,1
News Outlets Seek a Boost as Inauguration Watch Parties Are Planned,0
What Song Always Makes You Feel Like A Badass,1
The Author Of A Series Of Unfortunate Events Just Donated $1 Million To Planned Parenthood,1
Australian football Melbourne through to A-League Grand Final Adelaide to play Queensland in preliminary final,0
These Horrifyingly Satisfying Photos Of Baby Foot Will Haunt You,1
Can You Identify The Rihanna Music Video By A Single Screenshot,1
A$AP Rocky Has The Coolest Instagram You've Ever Seen,1
23 Insane Things Women Have Actually Found In Their Boob Crack,1
Disneyland celebrates fiftieth anniversary,0
British pop star Leona Lewis breaks US Billboard records,0
Jury suggests the death penalty for Scott Peterson,0
Cargo ship Arctic Sea may be found,0
FDA report criticizes conditions in factory that produced recalled medications,0
These Three Questions Will Tell You Which Big City To Live In,1
Imprisoned American journalists in North Korea pardoned to return to US,0
We Need To Talk About How Insanely Perfect Zac Efron And Sami Miro Are Together,1
8 Songs That Will Make You See Kesha In A New Light,1
59 Rihanna Lyrics For When You Need An Instagram Caption,1
17 Times The Internet Perfectly Captured Being A Capricorn,1
11 Facts Your History Teacher Forgot To Mention,1
Markets rally as world's central banks infuse cash,0
American musician Bo Diddley dies at age 79,0
Though Hobbled North Carolina Gets by Virginia Tech,0
Ties found between Abu Ghraib prison abuse and Guantanamo Bay,0
We Need To Talk About The Perfection That Is Leonardo DiCaprio's BAFTAs Suit,1
Ryan Reynolds Thinks Superhero Movies Should Have More Sex And Violence,1
Senior citizen group seeks recovery of Medicare expenses from US cigarette makers,0
US automaker Chrysler wants to eliminate 789 dealerships,0
Pakistan  New policy on renewable energy launched,0
FDA recalls Mama's brand smoked salmon,0
Neighbors Joined for a Battle Not All Would Win,0
Crash in Iraq Kills 4 US Soldiers,0
The Try Guys Imitate Each Other,1
Which Food Should You Encase In Sweet Gelatin This Year,1
18 Things That Happen When Your Best Friend Comes Into Town,1
One Direction's New Music Video For Perfect Is Actually Perfection,1
17 Words That Take On New Meaning When You Have Periods,1
The Fish Are Biting and the Room Is Hopping,0
27 Of History's Most Iconic Rock Stars As Youngsters,1
Massive traffic jams gas shortages plug evacuation routes near Houston,0
Tankers taken by pirates in Indian Ocean,0
Galloway and Pasqua deny any wrongdoing on their part in the oil-for-food program,0
An Engineering Student Eloquently Pointed Out Why Female Classmates Aren't Equal,1
5 Stages Of The Yom Kippur Fast Illustrated By Amy Schumer,1
Joachim to attempt breaking record for static cycling,0
Ramadan begins today in India,0
OJ Simpson found guilty in kidnapping armed robbery case,0
26 Important Dating Takeaways From Master Of None,1
The Struggles Of Being A Sleepwalker,1
New Year's Eve Underwear Traditions Around The World,1
Stewart battles rain to win Pepsi 400 at Daytona,0
2007 Rugby World Cup Tonga Fiji and Italy win,0
Sebastian Vettel wins 2008 Italian Grand Prix,0
Man arrested in connection with July 21 London bomb attempts,0
David Bowie's Son Revealed He's Going To Be A Father With A Very Sweet Cartoon,1
Mickelson and Watney Share Lead at Doral,0
Why The Hole Is The Best New Emoji,1
Auto Aid Might Flow To Parts Suppliers,0
New Jersey backpedals on proposed bikini waxing ban,0
23 Wonderful Feet Pics That Will Give You Wanderlust,1
Bin Laden's former driver convicted of supporting terrorism,0
3 Lawmakers Will Return Money Tied to Lobbyist,0
US Begins Third Effort to Convict 6 in Terror Case,0
Court jails Gloucestershire UK cop who left freezing man to die,0
People Met Pet Rats For The First Time And Lost Their Damn Minds,1
17 Things That Will Instantly Make Your Day Better,1
Here Are Some Very Important Writing Tips From Neil Gaiman,1
25 Words You Don't Actually Understand Unless You're A Doctor Who Fan,1
3 dead 4 missing after Vietnamese cargo ship sinks in South China Sea,0
US Captain Hears Pleas for Afghan Detainee,0
Thoughts You Have While Waiting For A Date,1
This Mac And Cheeseburger Is The Only Friend You Need,1
Women Got Transformed Into Telenovela Stars And Looked Dramatic AF,1
Truck carrying explosives crashes explodes in Utah,0
How Does Your Interfaith Family Celebrate The Holidays,1
This Instagram Account Satirizing Fancy Dining Is Actually The Work Of A Canadian Chef,1
31 Apartment Hunting Tips Everyone Needs To Know,1
23 Confessions From Short Guys That Prove Body-Shaming Is Real,1
Travelers Your Tour Bus Is Boarding for Basra,0
Chilean court jails ex-army officers for murdering witness in Croatian arms deal,0
Indiana businessman held hostage in Iraq,0
17 Times America Got Burned By Tumblr,1
Apple Inc co-founder Steve Jobs dies aged 56,0
Tanker crash kills two in Brevard County Florida,0
Impress Fellow 90s Kids With This Fresh Prince Basketball Jersey,1
What Is Your American Horror Story Porn Star Name,1
15 Times Indian Newspapers Messed Up In 2015,1
We Know If You're Hungry Based On Your Reaction To These GIFs,1
10 Mundane Things About Fall That Are Actually The Most Terrifying,1
What To Do When You Sleep Next To Someone Who Is Too Warm,1
One Side Makes Offer in Honduran Impasse,0
What Is Your Booze IQ,1
18 Things Every Beer Drinker Needs To Know,1
20 Times Whose Line Is It Anyway Was The Greatest Show On TV,1
Alassane Ouattara 'wins' Ivory Coast presidential election,0
A Little Rugby With Your Cross-Dressing,0
UK government's Information Commissioner takes enforcement action against Liberal Democrat party for cold calling voters,0
Brace Yourself America All Dressed Chips Are Coming,1
How New Jersey Are You,1
Supreme Court Ruling Offers Little Guidance on Hiring,0
