Text,Category
These Are The 20 Most Shipped Couples Of 2015,1
It's The Moment You've Been Waiting For 100 Years Of Hamster Beauty In 60 Seconds,1
Answer These Questions And We'll Tell You Which Bring It On Cheerleader Audition You Are,1
US air carrier Spirit Airlines announces $45 carry-on baggage fee,0
95 Thoughts Everyone Has When They Are Stoned AF,1
Are You Scylla Or Charybdis,1
How Do You Keep The Romance Alive After Kids,1
Proposed United States doctrine would expand possible use of nuclear weapons,0
17 Memes That Are Way Too Real For Thirtysomethings,1
Knicks Getting in the Habit of Beating Good Teams,0
For Traveling Mothers Hurdles in Pumping Breast Milk,0
23 Things That Are Metal As Fuck,1
24 Annoying Things Only Hairy Girls Will Understand,1
This Facebook Post About A Lost Dog Has A Surprise Ending,1
24 Times Kris Jenner Was Shut Down By Her Own Kids,1
29 Celestial Accessories You'll Be Over The Moon For,1
Two French journalists kidnapped by Somali gunmen,0
The Hardest 2015 Quiz You'll Take This Year,1
Maker of Newsprint Trying to Restructure Debt,0
36 Backstage Celebrity Instagrams From The Emmys,1
Neolithic noodles found in Qinghai China,0
NCAA Ban on Lawyers for Athletes Is Ruled Illegal,0
What Percentage Do You Have Of Winning The Royal Rumble,1
Ariel Sharon former Prime Minister of Israel dies at 85,0
13 Questions BSB And NKOTB Fans Are Tired Of Hearing,1
Jailed American journalist in Iran sentenced to eight years in prison,0
Should You Study For Finals Or Watch Netflix,1
Calpers to Oppose Re-election of Bank of America Board,0
UConn Reportedly Violated NCAA Contact Rules in Recruitment of Nate Miles,0
is a city in the Free State of Saxony  Germany,1
Bengali Brahmins have produced more Nobel breakthroughs in terms of population than white/Japanese  but not as good as Ashkenazi JewHow it's possible,0
Do illegal Mexicans bring all kinds of illnesses back to America,0
Why do you think European Americans do mass shooting  but African Americans don't What is difference between them,0
Will you go to hell because being a transgender Do God hates them,0
When will China relax its visa regime towards Pakistani citizens This is hurting Chinese tourism hugely,0
Why dont Germans officially recognize Namibian Genocide,0
Are feminists against the notion of safety,0
Are Asians views a bit narrower due to the thinner eyeholes Not trying to offend,0
Was Robert Byrd a DINO,0
How can we educate Westerners using great Chinese philosophy,0
Does the president of Belgium Macaron eat macarons the food,0
Where in Mumbai do nurses in hospitals wear short skirts without panties,0
How do I forgive my wife who told me no sex before marriage  but after we married  I learned at age 12  she had already lost her virginity,0
Why do some many people on  use the word dating so much Do they really know what the word dating means,0
Do most non-Muslim Malaysians today look down on Muslim Malaysians and consider them to be hypocrites for choosing not to turn their nation into a completely Islamic country governed by Sharia Law,0
Why are Pashtuns so obsessed about skin color,0
Did Modi ever sell panipuri in Nepal,0
How come most people in USA do not care about how the killer Bush killed 1 million iraqui people,0
Why are Indian men desperate to get married but despises their wives  makes fun of them in social gatherings and acts as if their wives are the making their lives hell as soon as they are married,0
Is Trump turning Mueller's witch hunt into a wild goose chase,0
is a duty free island,1
USB Creator is a free software for Windows,1
North American Free Trade Agreement has two supplements,1
Turning to the Public for Advice on a Budget,0
What Is The Most Random Halloween Costume Your Kid Has Come Up With,1
reception for The Wild has been negative,0
Can You Tell Which Lifetime Movie Titles Are Real,1
This Year-End Mashup Of 98 Songs Is Fucking Fantastic,1
How Well Do You Remember The 2015 Oscars,1
Atomic Agency Examines Candidates to Replace ElBaradei,0
Kaczyski takes the office of Polish president,0
NASA rethinks abandoning Hubble,0
17 Brilliant Slow Cooker Hacks,1
This Food Stylist Gave Us 5 Tips To Make Normal Food Look Amazing,1
US Air Force tests Minuteman III missile,0
19 Gorgeous Finnish Baby Names That Will Make You Broody,1
38 killed after US helicopter crashes in Afghanistan,0
Dubai World refused permission to use QE2 as floating hotel in Cape Town,0
Longer Unemployment for Those 45 and Older,0
We Know Which Canadian City You Should Actually Live In,1
Do You Actually Remember These Disney Channel Show Theme Songs,1
Coca growth up in Bolivia Peru claims US State Department,0
Blagojevich Makes a Day of It on Way Out,0
Grab Your Earphones And Listen To This Gorgeous Instrumental Cover Of Adele's Hello,1
19 Foods That Are Probably Sad That They Exist,1
This Is The Easiest Way To Have Eggs And Toast For Breakfast,1
Honduran Rivals See US Intervention as Key to Ending Crisis,0
The Guy Who Wrote Hamilton Also Wrote The New Star Wars Cantina Song,1
24 Things All Theme Park Lovers Will Understand,1
Latvian government takes majority stake in Parex Bank,0
17 Gorgeous Gallery Walls You'll Want To Recreate In Your Own Home,1
US wildfire reaches Interstate 5 near Los Angeles,0
San Francisco Identifies Buildings Most at Risk,0
JLo Just Slayed The AMAs Stage With An Insane Dance Medley,1
16 Most Imaginative Art Vines Of 2015,1
Boston Celtics win 17th NBA championship,0
19 Things You Need To Survive The Impending Winter Maelstrom,1
Here 17 Gifts For Food-Obsessed People That Are Under $25 On Amazon,1
28 Photos That Will Give You Serious Relationship Goals,1
NASCAR Jamie McMurray wins 2010 Bank of America 500,0
As His Fans Stay Late Andy Murray Stays Alive at Wimbledon,0
What Unnatural Color Should You Dye Your Hair,1
This 4 Question Gilmore Girls Quiz Will Determine What Kind Of Coffee Drinker You Are,1
16 Teens Who Are Going To Rule The World In 2016,1
Guys Get '90s Boyband Makeovers For Their Significant Others,1
29 Ridiculously Stylish People From Toronto Fashion Week,1
This Dad Wrote A Check To His Kid's School Using Common Core Math,1
Internal audit reveals IRS improperly identified hundreds of thousands of taxpayers as potential frauds,0
Watch These Grown-Ups Freak Out Over Virtual Puppies,1
More Business Travelers Putting Away the Suitcase,0
Calvin Harris Congratulated Taylor Swift With A Cute Instagram Post,1
Are You Pikachu Or Meowth,1
This Dying Man Got To See His Beloved Horse One Last Time,1
Filipino Veterans Benefit in Stimulus Bill,0
American actor and star of 'Frasier' returns to hospital,0
Panic-buying as petrol protests sweep Britain,0
This Is What Women With The Same BMI Look Like Side By Side,1
US fighter jet crashes in Libya,0
Brazil's Embraer plans to cut around 4200 jobs,0
Joe McElderry wins UK X Factor final,0
Woman 87 raped in her own home in UK,0
Arrested Marxist leader Apablaza charged in Chile,0
For Taitusi Lutui a Journey From Tonga to the Super Bowl,0
Chris Rock Promises The Oscars Will Be Full Of Drunk Disappointed People,1
Super Bowl XLVII Ravens defeat 49ers 34-31,0
UK sending additional 500 troops to Afghanistan,0
New Zealand Music Month kicks off for 2008,0
Sky High Is Actually Just An Avatar The Last Airbender High School AU,1
UK's Labour government faces cabinet resignations electoral defeat,0
On Easter Pope Ponders Life Death and Reconciliation,0
A Sale to Benefit Charity and Thrifty Brides-to-Be,0
Large earthquake hits central China,0
United States Senate passes financial overhaul bill,0
Murder Trial Tests Colorado Hate-Crime Statute,0
Things That Make 20-Somethings Feel Old,1
20 Doctor Who Questions That Are Impossible To Answer,1
17 Mindblowing Ways To Eat Bagels,1
27 Utterly Terrible Ways Food Was Actually Served In 2015,1
Is This A Diploma Or Toilet Paper,1
US to transfer some Guantanamo detainees to Afghanistan,0
Bin Laden banished from Islam in Iberia,0
What's The Best Kind Of Penis For You Based On Your Zodiac Sign,1
The Socialist Left Partys election initiative starts in Norway,0
Mainers Air Their Views on Same-Sex Marriage,0
Pakistani Military Moves to Flush Out Taliban,0
Felipe Massa wins 2008 Bahrain Grand Prix,0
Chinese bloggers on Microsoft's MSN now face regulation of censors,0
Democratic Republic of Congo UN expert accuses soldiers of killing 50 Hutu refugees in North Kivu,0
22 Adorable Things You Need If You Love Pandas,1
Vandals deface family crypt of Pierre Elliott Trudeau,0
23 Vegan Recipes You Need To Try This Autumn,1
Four British Airways executives charged with price fixing,0
If Harry Potter Characters Were In Game Of Thrones,1
10 Badass Hairstyles You Need To Try Immediately,1
Cuba sentences USAID worker to fifteen-year prison term,0
24 Pictures That Are All Too Real For Twentysomethings,1
23 Profoundly Disturbing Photos Of Homemade Sex Machines In America,1
Everyone Just Found Out That Denzel's Son Is Really Hot,1
Some Gaza Strip students to go without textbooks,0
When Someone Farts At Work,1
Who Sang It Trace Adkins Or Dustin Lynch,1
21 Photos That Prove Anyone Can Rock A Pair Of Duck Boots,1
22 Dudes Tell Us About The Last Time They Cried,1
Dow falls 340 points amid unemployment and retail sales rates news,0
Uzbeks fleeing across border to seek refuge,0
Blackwater mercenaries used in New Orleans,0
This Little Girl Reacting To The Reveal Of Luke Skywalker's Father Is All Of Us,1
22 Photos That Show Just How Insane '90s Rave Culture Really Was,1
How People Who Have Struggled With Eating Disorders See Fat,1
Keselowski Wins at Talladega After a Wild Final Lap,0
To Capitalist Folly Town in Spain Offers Reply,0
Nightwish announce details of new album,0
How Well Do You Remember Firefly,1
18 Adorable Illustrations Of Untranslatable Words About Love,1
19 Painfully Honest Confessions From People Who Experience Panic Attacks,1
19 Homemade Food Gifts That You Can Actually Make,1
The New Burrito Emoji Is Problematic,1
What Is The Best Underrated Game App,1
I Lived According To DJ Khaled's Incredible Snapchat For A Day,1
Former Taiwanese president jailed for life on corruption charges,0
A Walled City in Tuscany Clings to Its Ancient Menu,0
Leading St Jude Classic Brian Gay Is One Round From US Open Berth,0
7 Winter Dinners That Anyone Can Make,1
29 Horrible Things That Happen When You Put Your Retainer In For The First Time In Forever,1
Syria fires on Israeli fighter planes,0
Several large earthquakes shake Indonesia,0
21 Things That Will Make All '00s Girls Feel Old,1
Young Japanese Raise Their Voices Over Economy,0
19 Problems Teenagers Who Over-Straightened Their Hair Had,1
26 Times Ron Swanson Was The Funniest Character On Parks And Recreation,1
In Iran Khatami Loses a Key Backer,0
21 Pictures That Pretty Much Sum Up Being A Human,1
Renewed concern over nuclear response following atomic bomb anniversary,0
Salmonella outbreak sickens over one thousand in United States,0
California governor Schwarzenegger presents new budget plan,0
Can You Predict The Winners Of The 2016 Golden Globe Awards,1
Investors Say They Are Talking to GM About Saturn,0
The Cast Of The Office Reimagined As Disney Characters,1
Huffington Post to Back Investigative Journalism Team,0
Explosion kills 42 miners in northern China 27 missing,0
Grandparents Give Love Advice,1
12 Pictures Of Water Bodies In India That Could Become Your New Happy Place,1
The Terrible Tale Of My Racist One-Night Stand,1
Algiers protest takes place despite ban,0
The Only Plans You Should Be Making This Valentine's Day,1
London police launch new anti-gang taskforce,0
18 Ridiculously Easy Ways To Be Better At Working Out,1
A 65-Year-Old Man's Typewriter Was Destroyed By An Angry Cop And The Internet Got Him A New One,1
Scotland defeats England 15-9 to win Calcutta Cup,0
Renault F1 given suspended ban as boss barred after cheating,0
Would You Smooch These Animals,1
APEC leaders wear Driza-Bones for group photo,0
Saudi Arabia announces 149 al-Qaeda arrests in last eight months,0
9 Comics That All Makeup Addicts Will Love,1
42 Things That Would Happen If Mean Girls Were Set In The Philippines,1
Drunk People Drunk Dial Their Loved Ones,1
US automaker GM plans to close 1100 dealerships,0
FDA ruling on emergency contraceptive pill questioned,0
Taylor Swift Performing At Stagecoach Is Actually You On The Weekend,1
17 Of The Most Unforgettable Moments From The Bachelor In 2015,1
Trial Begins for Khmer Rouge Leader,0
Global stock markets plunge,0
37 Photos That Will Annoy You More Than Is Actually Reasonable,1
Three killed in Utah coal mine rescue,0
Celebrities Around The World Have Paid Tribute To David Bowie,1
'Expelled' fair use upheld,0
A Box of Cash Yields a Mystery,0
Australian rules football 2010 Gippsland Football League finals take shape two weeks out,0
31 Facts You Probably Don't Know About Edward Scissorhands,1
17 Times Titus Andromedon Lived Life To The Absolute Fullest,1
Barack Obama wins Nobel Peace Prize,0
14 Deliciously Insane Ways To Celebrate National Cheeseburger Day,1
European Union to fund scheme to reduce aircraft emissions and noise pollution,0
Unwinding Fed Support,0
We Know Which Emoji You Are Based On Your Zodiac Sign,1
Poll What Was The Scariest Character On Are You Afraid Of The Dark,1
Administration Plans Tougher Antitrust Action,0
Thousands demand climate change action,0
Kanye West Finally Tweeted Something Lovely And It's About North Obviously,1
Do You Actually Remember What Cereal Mascots Look Like,1
In US Steps Toward Industrial Policy in Autos,0
Favorites and a Few Surprises Emerge at Wimbledon,0
43 Life-Changing Books You Need To Read,1
WHO H1N1 influenza virus still a pandemic,0
Christchurch NZ man admits murdering wife and neighbour and having sex with bodies,0
Can You Guess The One Direction Music Video By Its YouTube Comment,1
50 Cent Let His Money Do The Talking In An Instagram Response To Rick Ross,1
How Well Do You Know These Iconic Wedding Dresses,1
Vast Spy System Loots Computers in 103 Countries,0
9 Deliciously Fabulous Ways To Enjoy Chimichurri,1
Fake Jackson suicide email hides virus,0
In Ohio a Growing Market for the Mexican Drug Trade,0
16 Cookie Sandwiches That Will Change The Way You Eat Dessert,1
Thieves Kept Stealing And Then Crashing This Poor Canadian Guy's Truck,1
Commemoration of Srebrenica massacre to be held on July 11,0
Taiwan's cabinet resigns,0
33 Powerful Books That Can Help With Your Depression,1
What Was The Worst Netflix And Chill You've Experienced,1
12 Everyday Activities That Might Actually Be Good For You,1
12 Recipes that Celebrate the Chocolate Chip Cookie,1
How Offended By The Starbucks Cups Are You Actually,1
22 Hilarious NetflixPHShows That Should Actually Exist,1
Premier League 2007/08 Chelsea 2/1 Arsenal,0
If The Kardashians Wrote Greeting Cards,1
First Nestorian search engine goes online,0
Orlando Advances Ousting Cavaliers,0
14 Times Blair Waldorf Was Right About Everything,1
Gannett Plans to Furlough Employees for a Week,0
US and European Officials Discuss Detainees,0
Farmers hunt for missing bull semen,0
Baldwin Seymour among attendees at Oscar viewing party held by Children Uniting Nations,0
36 Pictures Of People Living Their Best Onesie Lives,1
Balancing Freedom and the Role of the State in Germany,0
Palestinian security forces clash with militants Palestinian Interrior Minister Nasser Yousef declares state of emergency,0
Sarah Jessica Parker Said She Didn't Read The Criticism About Sex And The City 2,1
This Inkblot Test Will Determine What You Hate The Most,1
Two Killed in Violence on Gaza Border,0
Western Stars win Women's National Wheelchair Basketball League championship in a thriller,0
Bank of Japan Will Buy More Government Bonds,0
Tiger Woods a Mainstay of Weekends at Majors Falls Out of the British Open,0
Noel Gallagher quits Oasis,0
How Well Do You Remember The Vampire Diaries Murder House Party,1
GM and Union Reach Deal on Contract Changes,0
Push in Spain to Limit Reach of the Courts,0
The New Genre Of Trans Women's Memoirs Lives Beyond Our Identities,1
For Barnes Second Place Is Not So Disappointing,0
Simple Leopard Halloween Makeup You Can Do In 10 Minutes,1
44 Things Every Emo Kid Thinks During The Holidays,1
Last WWII Comanche 'code talker' dies,0
19 Insane Platform Shoes You Need Immediately,1
These Cops Took Care Of A Sick Woman's Five Children When She Went To The Hospital,1
Can You Guess The Premier League Club From Just Their Socks,1
People from Pichilemu Chile leave La Cruz Hill,0
This Is The Difference Between Freshman Year And Senior Year Of College,1
Coosh Headphones Are Meant to Stay Put,0
Tsunami deaths mount to more than 120000,0
21 Signs You're Addicted To Your Goddamn iPhone,1
People limited to 150 friends despite Facebook says academic,0
21 Incredibly Laid-Back Dump Dinners That Are Tasty AF,1
This Guy's Cheese Vine Perfectly Sums Up How Silly The Daily Mail Is,1
Months After Plant Closed Most Workers Are Still Struggling,0
A Groom Just Put Every Other Guy To Shame By Creating A Mash-Up Song For His Wedding Vows,1
New Glitter Roots Hair Trend Has Women Dumping Sparkles Onto Their Heads,1
19 Brutally Honest Confessions From Bridesmaids,1
What Gift Should You Get For Yourself This Year,1
Security Faulted for No-Shows at Papal Mass,0
Florida Speaker Steps Down Citing Corruption Investigation,0
US Senate says no to pullout of US troops from Iraq,0
In Area Packed With Prisons a Split on Jihadists,0
Murder-Suicide Leaves 7 Dead in California,0
18 Things We Know About The Gilmore Girls Revival So Far,1
Australian rules football Bairnsdale join Gippsland League will play first game in Warragul,0
US man murdered by wife in Hong Kong,0
Fire breaks out in Ku-ring-gai Chase National Park Australia,0
We Did Things Men Stereotypically Do And Here's How It Went,1
President of Mexico Urges Action on Emissions,0
The Most Beautiful Wedding Dresses You've Never Seen Are From Asia,1
How Well Do You Remember Characters' Superpowers On Heroes,1
Broadcasters push for new layer of intellectual monopoly at WIPO,0
Do You Belong With Anakin Skywalker Or Kylo Ren,1
15 Reasons Why North West And Penelope Disick Are The Cutest BFFs,1
After Her Photographer Was A No-Show For Her Wedding This Bride Received A Surprise Of A Lifetime,1
Anthrocon 2007 draws thousands to Pittsburgh for furry weekend,0
42 Photos Of What It Looked Like Inside Kanye West's Fashion Show,1
New Zealand's worst behaved politicians list released,0
Pakistan 38 Talibani insurgents killed in two seperate attacks in Orakzai area,0
Second pipeline blast hits Canadian region,0
Tea Time Around The World,1
What People Say To Someone Who Is Single Vs What They Hear,1
A Mexican Tradition Runs on Pageantry and Faith,0
We Need To Talk About Kesha,1
Don't Try To Make Your Own Homemade Creme Eggs Because It's More Trouble Than It's Worth,1
Fans Have Doubts as Fordham Basketball Struggles,0
23 Pictures People Under 6 Feet Will Never Understand,1
Cricket England draw Test series opener with India,0
As Italy prepares for new government shots fired near prime minister's office,0
Advisory Against Visiting Caves,0
Republicans Subpoenaed in Ohio Recount,0
New Jersey jury clears man of five murders over 1978 teens' disappearance,0
Yahoo7 creates joint venture with Xtra,0
Rebel leader says he will run for president in Haiti,0
10 People Who Lost 50 Pounds Share Their Best Tips For Getting Started,1
Connecticut Men Keep Rolling in Big East Play,0
Japan Orders Citigroup to Stop Advertising Its Retail Bank,0
London Underground train derails leaving passengers trapped,0
12 Things Cubans View Differently,1
Erykah Badu's Phone Down $$$$ Is Everything You Ever Needed,1
12 Photos That Reveal The British Class System In The 1970s And 1980s,1
BU Defenseman Wins Hobey Baker and Eyes National Title,0
Let's Settle This How Would A Dog Wear Pants,1
The Doctor Who Taste Test,1
Are You More Nick Or Joe Jonas,1
US Soccer Team Looks Ahead to World Cup Qualifier With El Salvador,0
South African sprinter Philip Rabinowitz dies at age 104,0
New computer worm poised to cause massive outages,0
US millitary says it killed approximately 40 'insurgents' in Iraq,0
NATO airstrike kills seven Afghan security forces members,0
Horchata Cold Brew Is A Thing And You Need To Try It ASAP,1
This Proposal Cake Will Put All Other Proposals To Shame,1
Judge Approves $333 Billion Federal Loan to GM,0
Did You Prefer The Broadway Show Or The Movie,1
These 23 Tweets Will Make You Feel Better About Your Life,1
Are You More Dipper Or Mabel From Gravity Falls,1
16 Things Lady Gaga Looked Like During Her Super Bowl Performance,1
Warner Music Is Singing Again,0
43 dead in Iraqi bomb blast,0
Terror suspects arrested in connection with bombing public bus in Israel,0
Warming Relationships in a Warm Locale,0
33 Love Songs From The Early '00s You'll Never Forget,1
Mayor of Pitcairn Islands charged with possessing child porn,0
Whitney Port From The Hills Is Still As Shocked As Ever,1
We Know Your Bodily Talent Based On Three Questions,1
What's The Best Place To Buy Affordable Jewelry Online,1
In Lawsuit a Dispute Over Whether Roberto Alomar Has HIV,0
Where The Hell Is The Redhead Emoji,1
17 Real Canadian Horror Stories That Will Keep You Up At Night,1
29 Times John Francis Daley Was The Best Person On Twitter,1
How Well Do You Know These Viral Vines,1
Four feared dead in Ireland helicopter crash,0
New Lessons for the Army on Iraq Duty,0
Obama Would Move Some Detainees to US,0
Consumer Confidence Rose Sharply in May,0
NSYNC Vs Backstreet Boys,1
11 Times One Direction Was Literally Dragged Down,1
In Overtime Again Celtics Keep Their Cool,0
Charter Companies Flying to Cuba Thrive Despite Complaints,0
Why are most so nerdy and obsessed with hearing themselves talk,0
Since many Kurds claim that a Kurdistan exists  why cant I find it on my world map Where is Kurdistan,0
Why do the vast majority of American citizens not understand that the 16th amendment did not confer the Congress with any new powers of taxation,0
Open the link bellow Look at the right side  the list of similar questions This is the perfidious NLP-implanting of war-idea of Jewish elites Why the  Moderation does not react,0
Are Jews out to get me,0
I don't mean to be racist  but why are black people so fixated on people not being racist to them  but contradict themselves by creating stereotypes and using racist slang towards themselves At least  this is where I live  but still,0
If Islam  Sharia    are truly important to Muslims  why not remain in an Islamic country  rather than moving to the West and trying to impose Islam here Is the motive of greed for material things more important than the spiritual need,0
Who are most narcissist men or women,0
Why do Swedes ignore that there is a migrant rape problem,0
Can women have more passionate sex with a small penis guy than a big penis guy although a small penis is a turn off,0
Is  either loosely or strictly a dopamine trap,0
Why is it that when a girl is shy  she's cute  but when a guy is shy  he's a weird,0
Is Hardik Pandya a total idiot or a moron,0
Why do the Chinese think that the future belongs to China,0
Do Arab Muslims dont see Black Africans as equal,0
What standard of living does an average Russian have Whilst on holiday in Cyprus  I witness them filling their bags with food at breakfast time They steal food at every meal,0
My Indian housemate is incredibly stinky and she makes the whole apt stinky She said she can't smell anything and this is my nose problem Can't Indian smell themselves,0
Is it true that Japanese girls sleep with a lot of guys as shown in an interview,0
Here's The Real Deal With Drinking Activated Charcoal,1
Islanders Have Their Pick of Blue Chippers in NHL Entry Draft,0
These Are The 2016 Books Readers Are Most Pumped For,1
The Twilight Author Has Rewritten The Book To Reverse The Genders,1
7 Healthy Eating Tricks That Are Actually Realistic,1
17 Mouthwatering Risottos Guaranteed To Change Your Life,1
France calls on Libyan leader to step down,0
FYI The New Power Rangers Are Hot As Hell,1
Jon Snow Is Definitely Dead According To Maisie Williams,1
We Know Your Celebrity Crush Based On Your Birth Month,1
Which Christmas Movie Should You Watch Right Now,1
The 9 Celebrities Discover Their Inner Princess Puzzle,1
This Super Hot Guy Secretly Played Chewbacca In The Force Awakens,1
Japan raises severity level of crisis efforts to cool damaged nuclear power plant continue,0
Listen To Women Talk Honestly About Loving Their Bodies,1
Home Sales at Slowest Pace in More Than a Decade,0
Fred Thompson wins Georgetown County straw poll,0
Opposition Wins Presidency in Mongolia,0
Can You Actually See The Difference Between Black And Blue,1
American Society of Newspaper Editors Cancels Convention,0
Rihanna Was Literally Incredibly Amazingly Beautiful At The Dior Paris Fashion Week Show,1
Tropical Storm Epsilon forms as 2005 Atlantic hurricane season comes to an end,0
Heartbreaking Triage as Fargo Battles Floods,0
Re-creation of 1919 cross-Atlantic flight is successful,0
Grand Ayatollah Hossein Ali Montazeri dies,0
Premier Casting US Withdrawal as Iraq Victory,0
How Good Is Your Knowledge Of Classic Football Rivalries,1
18 Confessions From Men Who Call Themselves Feminists,1
British Army officer killed in Afghanistan,0
Study Drying up rivers to cause freshwater crisis,0
Clinton to Abbas Resume peace talks with no preconditions,0
Civil defence thwarts Israeli air strike on Gaza refugee camp,0
23 Free Health And Fitness Apps You Need To Download Immediately,1
Homes of six Minnesota politicians vandalized,0
Fashion Designer Rachel Roy On Her New Curvy Collection And Inspiring Women,1
Togo unanimously vote to abolish the death penalty,0
Are You More Hogwarts Or Xavier's,1
Emma Stone Is The Music Video Queen We've Always Dreamed Of,1
Can You Guess If These Are Sex Toys Or Just Regular Shit,1
Treasury Boss Taking Fire in Europe Over Stimulus,0
US GDP sees worst drop in five decades,0
Home Price Index Fell Again in November,0
