Text,Category
is so sad for my APL friend ,0
I missed the New Moon trailer ,0
Omg I'm gonna CRy I've been at this dentist since,0
i think mi bf is cheating on me,0
or i just worry too much ,0
My friend loved the salmon tartar,1
Waitress was good though,1
the food is rich so order accordingly,1
I loved the bacon wrapped dates,1
This is an unbelievable BARGAIN,1
The folks at Otto always make us feel so welcome and special,1
This is the place where I first had pho and it was amazing,1
This wonderful experience made this place a muststop whenever we are in town again,1
Very very fun chef,1
Great place to have a couple drinks and watch any and all sporting events as the walls are covered with TV's,1
Juuuuuuuuuuuuuuuuussssst Cool ,1
A very  very  very slow moving  aimless movie about a distressed  drifting young man,0
I must think about positive,1
thanks to all the haters up in my face all day,1
this weekend has sucked so far,0
ok that's it you win,0
Feeling strangely fine Now I'm gonna go listen to some Semisonic to celebrate,1
HUGE roll of thunder just now SO scary,0
Very sad about Iran,0
Headed to Hospital,0
BoRinG what's wrong with him Please tell me,0
goodbye exams HELLO ALCOHOL TONIGHT,1
I hate it when any athlete appears to tear an ACL on live television ,0
i miss you guys too i think i'm wearing skinny jeans a cute sweater and heels not really,0
SOX Floyd was great but relievers need a scolding ,0
Thanks for the help man ,1
Not finished not feeling well ,0
I feel the same way I just want to know what happened ,0
I'm good Going home in a few minutes How are you ,1
Yeah me too Be good Another time we will ,1
Talk to me pleeease No one else is and I'm all lone some,0
I dislike moving and dancing,0
thanxxx,1
Dammit I just checked and it hit me again,0
I can't hear anything But it LOOKS cute ,0
I'm making a list for a friend who hasn't seen A LOT of movies Great movies,1
So I assume you already had breakfast,1
Sorry hon hugs and cradles in arms I'm at work so I'm working ,0
super sarcasm I'm annoyed tired from 3 hrs of sleep working and my throat hurts,0
Thanks love I've been dying to see it Stupid technological difficulties ,0
Your welcome ,1
That is one way to put it I deliver what he sells absolutely I will be part,1
I am replaced already I thought I was coming back with my steaks ,0
I wish I could have gone I hate that they're always on wednesday how was Ian Galloway,0
It's kind of a long story But that def made my night I miss you more ,1
It takes a good 15 mins to calm down ,0
A Montenegro Who knew that it would bounce so Next time any foul are frozen you'll be the first ,1
I'll follow you into the dark I'm so talented at finishing lyrics lol ,1
are you jealous of my half bowl hair That's all I can see in the mirror half bow,0
i fail unless a sandwich counts ,0
takes a bow and snatches back those dollar bills Thanks dear At least SOMEONE,1
I'm the same hotel Be sure to let me know what time we're going to,1
yes yes it is glad you converted ,1
I rate you my most interesting person I follow ,1
That is alright I have loads of fun anyways ,1
i have no idea what your talking about ,0
when I get on the computer we gotta take more later on in the week ,1
I can't sleep either been up for hours,0
I emailed you guys for tickets 3 weeks ago and no replyyy ,0
I would say R Kelly the one and only king of R&B ,1
I'm not that's why I'm sulking not free all day ,0
I really dislike that,0
careful hugs,0
Everything on the menu is terrific and we were also thrilled that they made amazing accommodations for our vegetarian daughter,1
The atmosphere is modern and hip while maintaining a touch of coziness,1
Not a weekly haunt but definitely a place to come back to every once in a while,1
Love this place hits the spot when I want something healthy but not lacking in quantity or flavor,1
I ordered the Lemon raspberry ice cocktail which was also incredible,1
Interesting decor,1
What I really like there is the crepe station,1
Also were served hot bread and butter and home made potato chips with bacon bits on topvery original and very good,1
you can watch them preparing the delicious food,1
Both of the egg rolls were fantastic,1
That's messed up I'm sorry man,0
Not sure who was more lost   the flat characters or the audience  nearly half of whom walked out,0
Attempting artiness with black & white and clever camera angles  the movie disappointed   became even more ridiculous   as the acting was poor and the plot and lines almost non existent,0
Very little music or anything to speak of,0
The best scene in the movie was when Gerardo is trying to find a song that keeps running through his head,1
The rest of the movie lacks art  charm  meaning If it's about emptiness  it works I guess because it's empty,0
Wasted two hours,0
Saw the movie today and thought it was a good effort  good messages for kids,1
A bit predictable,0
Loved the casting of Jimmy Buffet as the science teacher,1
And those baby owls were adorable,1
The movie showed a lot of Florida at it's best  made it look very appealing,1
The Songs Were The Best And The Muppets Were So Hilarious,1
It Was So Cool,1
This is a very right on case movie that delivers everything almost right in your face,1
It had some average acting from the main person  and it was a low budget as you clearly can see,0
Great case and price,1
Bluetooth range is good a few days ago I left my phone in the trunk got a call and carried the conversation without a hitch,1
Small sleek impressive looking practical setup with ample storage in place,1
The eargels channel the sound directly into your ear and seem to increase the sound volume and clarity,1
I am glad I purchased it,1
No shifting no bubbling no peeling not even a scratch NOTHINGI couldn't be more happier with my new one for the Droid,1
I own a Jabra Earset and was very happy with it but the sound quality especially outgoing on this is better,1
I love the camera it's really pretty good quality,1
Thank you for such great service,1
It's a total package,1
I dislike it,0
This review is long overdue  since I consider A Tale of Two Sisters to be the single greatest film ever made,1
I'll put this gem up against any movie in terms of screenplay  cinematography  acting  post production  editing  directing  or any other aspect of film making,1
It's practically perfect in all of them  a true masterpiece in a sea of faux masterpieces,1
 The structure of this film is easily the most tightly constructed in the history of cinema,1
I can think of no other film where something vitally important occurs every other minute,1
In other words  the content level of this film is enough to easily fill a dozen other films,1
How can anyone in their right mind ask for anything more from a movie than this,1
It's quite simply the highest  most superlative form of cinema imaginable,1
Yes  this film does require a rather significant amount of puzzle solving  but the pieces fit together to create a beautiful picture,1
This short film certainly pulls no punches,0
Graphics is far from the best part of the game,0
This is the number one best TH game in the series,1
It deserves strong love,1
It is an insane game,1
There are massive levels  massive unlockable characters it's just a massive game,1
Waste your money on this game,1
This is the kind of money that is wasted properly,1
Actually  the graphics were good at the time,1
Today the graphics are crap,0
As they say in Canada  This is the fun game  aye,1
This game rocks,1
Buy it  play it  enjoy it  love it,1
she dislikes it,0
It's PURE BRILLIANCE,1
This was a flick doomed from its conception,0
The very idea of it was lame   take a minor character from a mediocre PG 13 film  and make a complete non sequel while changing its tone to a PG rated family movie,0
I wasn't the least bit interested,0
Not only did it only confirm that the film would be unfunny and generic  but it also managed to give away the ENTIRE movie and I'm not exaggerating   every moment  every plot point  every joke is told in the trailer,0
But it's just not funny,0
But even the talented Carrell can't save this,0
His co stars don't fare much better  with people like Morgan Freeman  Jonah Hill  and Ed Helms just wasted,0
The story itself is just predictable and lazy,0
The only real effects work is the presence of all the animals  and the integration of those into the scenes is some of the worst and most obvious blue/green screen work I've ever seen,0
But whatever it was that cost them so much  it didn't translate to quality  that's for sure,0
The film succeeds despite  or perhaps because of  an obviously meagre budget,1
I'm glad the film didn't go for the most obvious choice  as a lesser film certainly would have,1
In addition to having one of the most lovely songs ever written  French Cancan also boasts one of the cutest leading ladies ever to grace the screen,1
It's hard not to fall head over heels in love with that girl,1
On the negative  it's insipid enough to cause regret for another 2 hours of life wasted in front of the screen,0
Long  whiny and pointless,0
But I recommend waiting for their future efforts  let this one go,0
Excellent cast  story line  performances,1
Totally believable,1
Anne Heche was utterly convincing,1
Sam Shepard's portrayal of a gung ho Marine was sobering,1
I sat riveted to the TV screen,1
All in all I give this one a resounding 9 out of 10,1
I do think Tom Hanks is a good actor,1
I enjoyed reading this book to my children when they were little,1
I was very disappointed in the movie,0
One character is totally annoying with a voice that gives me the feeling of fingernails on a chalkboard,0
There is a totally unnecessary train/roller coaster scene,0
There was absolutely no warmth or charm to these scenes or characters,0
This movie totally grates on my nerves,0
The performances are not improved by improvisation  because the actors now have twice as much to worry about not only whether they're delivering the line well  but whether the line itself is any good,0
And  quite honestly  often its not very good,0
Often the dialogue doesn't really follow from one line to another  or fit the surroundings,0
It crackles with an unpredictable  youthful energy   but honestly  i found it hard to follow and concentrate on it meanders so badly,0
There are some generally great things in it,1
I wouldn't say they're worth 2 hours of your time  though,0
The suspense builders were good  & just cross the line from G to PG,1
I especially liked the non cliche choices with the parents in other movies  I could predict the dialog verbatim  but the writing in this movie made better selections,1
If you want a movie that's not gross but gives you some chills  this is a great choice,1
Alexander Nevsky is a great film,1
He is an amazing film artist  one of the most important whoever lived,1
I'm glad this pretentious piece of s    didn't do as planned by the Dodge stratus Big Shots It's gonna help movie makers who aren't in the very restrained movie business of Québec,0
This if the first movie I've given a 10 to in years,1
If there was ever a movie that needed word of mouth to promote  this is it,1
Overall  the film is interesting and thought provoking,1
Plus  it was well paced and suited its relatively short run time,1
I dislike hypocrisis,0
Give this one a look,1
I gave it a 10,1
The Wind and the Lion is well written and superbly acted,1
It is a true classic,1
It actually turned out to be pretty decent as far as B list horror/suspense films go,1
Definitely worth checking out,1
The problem was the script,0
this place is good,1
I was seated immediately,1
Their menu is diverse and reasonably priced,1
Restaurant is always full but never a wait,1
Mom disliked hot dog,0
DELICIOUS,1
This place is handsdown one of the best places to eat in the Phoenix metro area,1
Bacon is hella salty,1
This really is how Vegas fine dining used to be right down to the menus handed to the ladies that have no prices listed,1
The waitresses are very friendly,1
It was horrendous,0
There was NOTHING believable about it at all,0
The only suspense I was feeling was the frustration at just how retarded the girls were,0
MANNA FROM HEAVEN is a terrific film that is both predictable and unpredictable at the same time,1
The scenes are often funny and occasionally touching as the characters evaluate their lives and where they are going,1
The cast of veteran actors are more than just a nostalgia trip,1
Ursula Burton's portrayal of the nun is both touching and funny at the same time with out making fun of nuns or the church,1
If you are looking for a movie with a terrific cast  some good music including a Shirley Jones rendition of The Way You Look Tonight  and an uplifting ending  give this one a try,1
I don't think you will be disappointed,1
Frankly  after Cotton club and Unfaithful  it was kind of embarrassing to watch Lane and Gere in this film  because it is BAD,0
The acting was bad  the dialogs were extremely shallow and insincere,0
It was too predictable  even for a chick flick,0
Too politically correct,0
Very disappointing,0
The only thing really worth watching was the scenery and the house  because it is beautiful,1
I love Lane  but I've never seen her in a movie this lousy,0
An hour and a half I wish I could bring back,0
But in terms of the writing it's very fresh and bold,1
The acting helps the writing along very well  maybe the idiot savant sister could have been played better  and it is a real joy to watch,1
The directing and the cinematography aren't quite as good,0
The movie was so boring  that I sometimes found myself occupied peaking in the paper instead of watching  never happened during a Columbo movie before,0
  and sometimes it was so embarrassing that I had to look away,0
The directing seems too pretentious,0
Mother fucker,0
The scenes with the oh so mature neighbour girl are a misplace,0
And generally the lines and plot is weaker than the average episode,0
Then scene where they debated whether or not to sack the trumpeter  who falsely was accused for the murder is pure horror  really stupid,0
Some applause should be given to the prelude however,1
I really liked that,1
A great film by a great director,1
The movie had you on the edge of your seat and made you somewhat afraid to go to your car at the end of the night,1
The music in the film is really nice too,1
I'd advise anyone to go and see it,1
Brilliant,1
Play a song from Mandy Moore's new album thankss,1
well it's a good thing I'm 19,1
WE LOVE OUR TRAFFIC PRINCESS ,1
I'm probably the only person that thinks that's really cool ,1
10 million dollars so when true love comes i can spoil her ,1
Music sounds like an every day kinda kitchen ,1
oh sure that'll be amazing haha just update me with the date,1
You're too kind ,1
wish I could've been there ,0
Sorry Meant to buy some but was flat off my feet all day ,0
that song means so much to me Every time I tell someone though they just focus of the pros,0
something that i don't get to experience frequently ,0
10/10,1
I liked this movie way too much,1
My only problem is I thought the actor playing the villain was a low rent Michael Ironside,0
It rocked my world and is certainly a must see for anyone with no social or physical outlets,1
However  this didn't make up for the fact that overall  this was a tremendously boring movie,0
There was NO chemistry between Ben Affleck and Sandra Bullock in this film  and I couldn't understand why he would consider even leaving his wife to be for this chick that he supposedly was knocked out by,0
There were several moments in the movie that just didn't need to be there and were excruciatingly slow moving,0
This was a poor remake of My Best Friends Wedding,0
All in all  a great disappointment,0
I cannot believe that the actors agreed to do this film,0
I could not stand to even watch it for very long for fear of losing IQ,0
I guess that nobody at the network that aired this dribble watched it before putting it on,0
The seller is very understanding and patient I would definitely buy from them again,1
Great product for the price,1
I have purchased these for both family and friends and all enjoy their clarity and ease of use,1
Virgin Wireless rocks and so does this cheap little phone,1
All in all I'm quite satisfied with this purchase,1
Great it was new packaged nice works good no problems and it came in less time then I expected,1
Great Product,1
This fixes all the problems,1
I am very happy,1
I've had no trouble accessing the Internet downloading ringtones or performing any of the functions,1
I saw Mirrormask last night and it was an unsatisfactory experience,0
Unfortunately  inexperience of direction meant that scene after scene passed with little in the way of dramatic tension or conflict,0
These are the central themes of the film and they are handled ineptly  stereotypically and with no depth of imagination,0
All the pretty pictures in the world cannot make up for a piece of work that is flawed at the core,0
It is an hour and half waste of time  following a bunch of very pretty high schoolers whine and cry about life,0
You can't relate with them  hell you barely can understand them,0
This is definitely a cult classic well worth viewing and sharing with others,1
This movie is a pure disaster  the story is stupid and the editing is the worst I have seen  it confuses you incredibly,0
The fish is badly made and some of its underwater shots are repeated a thousand times in the film,0
A truly  truly bad film,0
i just had a bad dream and now i'm afraid to go back to sleep ,0
The acting is terrible  and the writing is worse,0
The only possible way this movie could be redeemed would be as MST3K fodder,0
I paid too much,0
Also  it's a real treat to see Anthony Quinn playing Crazy Horse,1
It was so BORING,0
No plot whatsoever,0
Again  no plot at all,0
Horrible,0
This is one of the best bars with food in Vegas,1
My drink was never empty and he made some really great menu suggestions,1
Nice blanket of moz over top but i feel like this was done to cover up the subpar food,1
The bathrooms are clean and the place itself is well decorated,1
we came in the middle of the day and we were greeted and seated right away,1
This is a great restaurant at the Mandalay Bay,1
Some highlights Great quality nigiri here,1
the staff is friendly and the joint is always clean,1
this was a different cut than the piece the other day but still wonderful and tender s well as well flavored,1
I ordered the Voodoo pasta and it was the first time I'd had really excellent pasta since going gluten free several years ago,1
Worst hour and a half of my lifeOh my gosh,0
I had to walk out of the theatre for a few minutes just to get some relief,0
I hate movies like that,0
Yeah  the movie pretty much sucked,0
THERE IS NO PLOT OR STORYLINE,0
If you do go see this movie  bring a pillow or a girlfriend/boyfriend to keep you occupied through out,0
Awful,0
I don't think I've ever gone to a movie and disliked it as much,0
It was a good thing that the tickets only cost five dollars because I would be mad if I'd have paid $750 to see this crap,0
NOBODY identifies with these characters because they're all cardboard cutouts and stereotypes  or predictably reverse stereotypes,0
This is a bad film  with bad writing  and good actorsan ugly cartoon crafted by Paul Haggis for people who can't handle anything but the bold strokes in storytellinga picture painted with crayons,0
Crash is a depressing little nothing  that provokes emotion  but teaches you nothing if you already know racism and prejudice are bad things,0
Still  I do like this movie for it's empowerment of women there's not enough movies out there like this one,1
It does everything the description said it would,1
It works great with a car charger especially if you cannot plug in two adapters at the same time,1
It plays louder than any other speaker of this size the price is so low that most would think the quality is lacking however it's not,1
Better than expected,1
Battery is holding up well,1
Linked to my phone without effort,1
THey are so cool,1
What the fuck,0
Easy to use,1
Better Than New,1
A pretty good product,1
Your brain will attempt to shut down as part of a primal impulse of self preservation,0
I was left shattered from the experience of watching this 'film' and I took a good two hours to fully recover,0
This movie now joins Revenge of the Boogeyman and Zombiez as part of the hellish trinity of horror films,0
I certainly do not mean this distinction in a good way,0
I mean this in a terrible way,0
This film has no redeeming features,0
Everything is appalling,0
Artless camera work endlessly presents us with the ugliest setting imaginable  ie,0
The story is beyond stupid,0
The script is was there a script,0
The kids are annoying,0
These are fabulous,1
I'd say that would be the hardest decision Honestly all of M's dishes taste how they are supposed to taste amazing,1
Everyone is very attentive providing excellent customer service,1
Now this dish was quite flavourful,1
Seriously flavorful delights folks,1
Much better than the other AYCE sushi place I went to in Vegas,1
The lighting is just dark enough to set the mood,1
Owner's are really great people,1
The Greek dressing was very creamy and flavorful,1
Now the pizza itself was good the peanut sauce was very tasty,1
We had 7 at our table and the service was pretty fast,1
The lead man is charisma free,0
Utterly without merit on any level  this is akin to torture,0
I'll even say it again  this is torture,0
Maybe there would be a reasonable explanation for this atrocity,0
Not a pleasant voyage of self discovery,0
Highly unrecommended,0
If this premise sound stupid  that's because it is,0
Yes  it's that bad,0
Nothing at all to recommend,0
An excellent performance from Ms,1
Garbo  who showed right off the bat that her talents could carry over from the silent era  I wanted to see some of her silent work  but Netflix doesn't seem to be stocking them,1
It's also great to see that renowned silent screenwriter Frances Marion hasn't missed a step going from silent to sound,1
This movie suffered because of the writing  it needed more suspense,0
There were too many close ups,0
But other than that the movie seemed to drag and the heroes didn't really work for their freedom,0
But this movie is definitely a below average rent,0
You'll love it,1
This movie is BAD,0
So bad,0
The film is way too long,0
This is definitely one of the bad ones,0
The movie I received was a great quality film for it's age,1
John Wayne did an incredible job for being so young in the movie industry,1
His on screen presence shined thought even though there were other senior actors on the screen with him,1
I think that it is a must see older John Wayne film,1
I really don't see how anyone could enjoy this movie,0
I don't think I've ever seen a movie half as boring as this self indulgent piece of junk,0
It probably would have been better if the director hadn't spent most of the movie showcasing his own art work  which really isn't that noteworthy,0
Another thing I didn't really like is when a character got punched in the face  a gallon of blood would spew forth soon after,0
Jamie Foxx absolutely IS Ray Charles,1
His performance is simply genius,1
That song's coming up,1
sucks,0
thnks for the info ,1
Go in hell,0
Amazing Would most definitely LOVE to see them again in concert ,1
He owns the film  just as Spacek owned Coal Miner's Daughter and Quaid owned Great Balls of Fire,1
 In fact  it's hard to remember that the part of Ray Charles is being acted  and not played by the man himself,1
Ray Charles is legendary,1
Ray Charles' life provided excellent biographical material for the film  which goes well beyond being just another movie about a musician,1
Hitchcock is a great director,1
Ironically I mostly find his films a total waste of time to watch,0
Secondly  Hitchcock pretty much perfected the thriller and chase movie,1
It's this pandering to the audience that sabotages most of his films,0
Hence the whole story lacks a certain energy,0
The plot simply rumbles on like a machine  desperately depending on the addition of new scenes,0
There are the usual Hitchcock logic flaws,0
Very windresistant,1
They do not last forever but is not overly expensive to replaceEasy to operate and the sound is much better than others I have tried,1
Phone is sturdy as all nokia bar phones are,1
Great phone,1
I'm pleased,1
I found the product to be easy to set up and use,1
No ear loop needed it's tiny and the sound is great,1
The handsfree part works fine but then the car tries to download the address book and the Treo rebootsOverall I still rate this device high,1
I'm happy about this purchase good quality and low price,1
I love the look and feel of Samsung flipphones,1
Mishima is extremely uninteresting,0
This is a chilly  unremarkable movie about an author living/working in a chilly abstruse culture,0
The flat reenactments don't hold your attention because they are emotionally adrift and stagy,0
And the rest of it just sits there being awful with soldiers singing songs about the masculinity they pledge themselves to  hairsplitting about purity  the admiration of swords  etc,0
He can bore you to pieces  and kill the momentum of a movie  quicker than anyone else,0
Schrader has made a resume full of lousy  amateurish films,0
When I first watched this movie  in the 80s  I loved it,1
I was totally fascinated by the music  the dancing everything,1
However  I recently watched the whole thing again on DVD  and I was completely struck by how extremely stupid the storyline was   how it contained holes  inconsistencies and   frankly   a whole lot of crap   and how horrid the dancing was,0
I mean  in a realistic world  she would NEVER have gotten into that ballet repertory The whole thing was quite pathetic,0
The character developments also lacked in depth,0
Woa  talk about awful,0
Do not waste your time,0
you are a loser,0
Service was fine and the waitress was friendly,1
